CODE,DESCRIPTION
A0101,TYPHOID MENINGITIS
A044,OTHER INTESTINAL ESCHERICHIA COLI INFECTIONS
A046,ENTERITIS DUE TO YERSINIA ENTEROCOLITICA
A049,"BACTERIAL INTESTINAL INFECTION, UNSPECIFIED"
A0811,ACUTE GASTROENTEROPATHY DUE TO NORWALK AGENT
A09,"INFECTIOUS GASTROENTERITIS AND COLITIS, UNSPECIFIED"
A3689,OTHER DIPHTHERITIC COMPLICATIONS
A4189,OTHER SPECIFIED SEPSIS
A481,LEGIONNAIRES' DISEASE
A483,TOXIC SHOCK SYNDROME
A5217,GENERAL PARESIS
A563,CHLAMYDIAL INFECTION OF ANUS AND RECTUM
A630,ANOGENITAL (VENEREAL) WARTS
A759,"TYPHUS FEVER, UNSPECIFIED"
A7740,"EHRLICHIOSIS, UNSPECIFIED"
A7982,ANAPLASMOSIS [A. PHAGOCYTOPHILUM]
A89,UNSPECIFIED VIRAL INFECTION OF CENTRAL NERVOUS SYSTEM
B0230,"ZOSTER OCULAR DISEASE, UNSPECIFIED"
B070,PLANTAR WART
B081,MOLLUSCUM CONTAGIOSUM
B159,HEPATITIS A WITHOUT HEPATIC COMA
B353,TINEA PEDIS
B360,PITYRIASIS VERSICOLOR
B391,CHRONIC PULMONARY HISTOPLASMOSIS CAPSULATI
B451,CEREBRAL CRYPTOCOCCOSIS
B59,PNEUMOCYSTOSIS
B690,CYSTICERCOSIS OF CENTRAL NERVOUS SYSTEM
B950,"STREPTOCOCCUS, GROUP A, CAUSING DISEASES CLASSD ELSWHR"
B951,"STREPTOCOCCUS, GROUP B, CAUSING DISEASES CLASSD ELSWHR"
B954,OTH STREPTOCOCCUS AS THE CAUSE OF DISEASES CLASSD ELSWHR
B966,BACTEROIDES FRAGILIS AS THE CAUSE OF DISEASES CLASSD ELSWHR
C069,"MALIGNANT NEOPLASM OF MOUTH, UNSPECIFIED"
C159,"MALIGNANT NEOPLASM OF ESOPHAGUS, UNSPECIFIED"
C188,MALIGNANT NEOPLASM OF OVERLAPPING SITES OF COLON
C211,MALIGNANT NEOPLASM OF ANAL CANAL
C220,LIVER CELL CARCINOMA
C228,"MALIGNANT NEOPLASM OF LIVER, PRIMARY, UNSPECIFIED AS TO TYPE"
C311,MALIGNANT NEOPLASM OF ETHMOIDAL SINUS
C3490,MALIGNANT NEOPLASM OF UNSP PART OF UNSP BRONCHUS OR LUNG
C3492,MALIGNANT NEOPLASM OF UNSP PART OF LEFT BRONCHUS OR LUNG
C4322,MALIGNANT MELANOMA OF LEFT EAR AND EXTERNAL AURICULAR CANAL
C4339,MALIGNANT MELANOMA OF OTHER PARTS OF FACE
C4440,UNSPECIFIED MALIGNANT NEOPLASM OF SKIN OF SCALP AND NECK
C4470,"UNSP MALIGNANT NEOPLASM OF SKIN OF LOWER LIMB, INCLUDING HIP"
C4499,"OTHER SPECIFIED MALIGNANT NEOPLASM OF SKIN, UNSPECIFIED"
C460,KAPOSI'S SARCOMA OF SKIN
C4911,"MALIG NEOPLM OF CONN AND SOFT TISS OF R UPR LIMB, INC SHLDR"
C495,MALIGNANT NEOPLASM OF CONNECTIVE AND SOFT TISSUE OF PELVIS
C4A61,"MERKEL CELL CARCINOMA OF RIGHT UPPER LIMB, INC SHOULDER"
C5031,"MALIGNANT NEOPLASM OF LOWER-INNER QUADRANT OF BREAST, FEMALE"
C5051,"MALIGNANT NEOPLASM OF LOWER-OUTER QUADRANT OF BREAST, FEMALE"
C548,MALIGNANT NEOPLASM OF OVERLAPPING SITES OF CORPUS UTERI
C5700,MALIGNANT NEOPLASM OF UNSPECIFIED FALLOPIAN TUBE
C5701,MALIGNANT NEOPLASM OF RIGHT FALLOPIAN TUBE
C574,"MALIGNANT NEOPLASM OF UTERINE ADNEXA, UNSPECIFIED"
C659,MALIGNANT NEOPLASM OF UNSPECIFIED RENAL PELVIS
C713,MALIGNANT NEOPLASM OF PARIETAL LOBE
C715,MALIGNANT NEOPLASM OF CEREBRAL VENTRICLE
C772,SECONDARY AND UNSP MALIGNANT NEOPLASM OF INTRA-ABD NODES
C7889,SECONDARY MALIGNANT NEOPLASM OF OTHER DIGESTIVE ORGANS
C7902,SECONDARY MALIGNANT NEOPLASM OF LEFT KIDNEY AND RENAL PELVIS
C7911,SECONDARY MALIGNANT NEOPLASM OF BLADDER
C7972,SECONDARY MALIGNANT NEOPLASM OF LEFT ADRENAL GLAND
C7B02,SECONDARY CARCINOID TUMORS OF LIVER
C7B09,SECONDARY CARCINOID TUMORS OF OTHER SITES
C800,"DISSEMINATED MALIGNANT NEOPLASM, UNSPECIFIED"
C8120,"MIXED CELLULARITY HODGKIN LYMPHOMA, UNSPECIFIED SITE"
C8192,"HODGKIN LYMPHOMA, UNSPECIFIED, INTRATHORACIC LYMPH NODES"
C8211,"FOLLICULAR LYMPHOMA GRADE II, NODES OF HEAD, FACE, AND NECK"
C8296,"FOLLICULAR LYMPHOMA, UNSPECIFIED, INTRAPELVIC LYMPH NODES"
C8382,"OTHER NON-FOLLICULAR LYMPHOMA, INTRATHORACIC LYMPH NODES"
C8389,"OTH NON-FOLLIC LYMPHOMA, EXTRANODAL AND SOLID ORGAN SITES"
C8400,"MYCOSIS FUNGOIDES, UNSPECIFIED SITE"
C8515,"UNSP B-CELL LYMPHOMA, NODES OF ING REGION AND LOWER LIMB"
C8585,"OTH TYPES OF NON-HODG LYMPH, NODES OF ING RGN AND LOWER LIMB"
C9141,"HAIRY CELL LEUKEMIA, IN REMISSION"
C9142,"HAIRY CELL LEUKEMIA, IN RELAPSE"
C9191,"LYMPHOID LEUKEMIA, UNSPECIFIED, IN REMISSION"
C9240,"ACUTE PROMYELOCYTIC LEUKEMIA, NOT HAVING ACHIEVED REMISSION"
C9251,"ACUTE MYELOMONOCYTIC LEUKEMIA, IN REMISSION"
C92Z0,OTHER MYELOID LEUKEMIA NOT HAVING ACHIEVED REMISSION
C9592,"LEUKEMIA, UNSPECIFIED, IN RELAPSE"
D001,CARCINOMA IN SITU OF ESOPHAGUS
D017,CARCINOMA IN SITU OF OTHER SPECIFIED DIGESTIVE ORGANS
D0339,MELANOMA IN SITU OF OTHER PARTS OF FACE
D0361,"MELANOMA IN SITU OF RIGHT UPPER LIMB, INCLUDING SHOULDER"
D060,CARCINOMA IN SITU OF ENDOCERVIX
D074,CARCINOMA IN SITU OF PENIS
D107,BENIGN NEOPLASM OF HYPOPHARYNX
D117,BENIGN NEOPLASM OF OTHER MAJOR SALIVARY GLANDS
D121,BENIGN NEOPLASM OF APPENDIX
D1430,BENIGN NEOPLASM OF UNSPECIFIED BRONCHUS AND LUNG
D151,BENIGN NEOPLASM OF HEART
D167,"BENIGN NEOPLASM OF RIBS, STERNUM AND CLAVICLE"
D168,"BENIGN NEOPLASM OF PELVIC BONES, SACRUM AND COCCYX"
D1771,BENIGN LIPOMATOUS NEOPLASM OF KIDNEY
D191,BENIGN NEOPLASM OF MESOTHELIAL TISSUE OF PERITONEUM
D2111,"BEN NEOPLM OF CONNCTV/SOFT TISS OF R UPPER LIMB, INC SHLDR"
D2311,"OTH BENIGN NEOPLASM SKIN/ RIGHT EYELID, INCLUDING CANTHUS"
D279,BENIGN NEOPLASM OF UNSPECIFIED OVARY
D287,BENIGN NEOPLASM OF OTHER SPECIFIED FEMALE GENITAL ORGANS
D2921,BENIGN NEOPLASM OF RIGHT TESTIS
D294,BENIGN NEOPLASM OF SCROTUM
D309,"BENIGN NEOPLASM OF URINARY ORGAN, UNSPECIFIED"
D3131,BENIGN NEOPLASM OF RIGHT CHOROID
D369,"BENIGN NEOPLASM, UNSPECIFIED SITE"
D375,NEOPLASM OF UNCERTAIN BEHAVIOR OF RECTUM
D379,"NEOPLASM OF UNCERTAIN BEHAVIOR OF DIGESTIVE ORGAN, UNSP"
D3A8,OTHER BENIGN NEUROENDOCRINE TUMORS
D421,NEOPLASM OF UNCERTAIN BEHAVIOR OF SPINAL MENINGES
D487,NEOPLASM OF UNCERTAIN BEHAVIOR OF OTHER SPECIFIED SITES
D494,NEOPLASM OF UNSPECIFIED BEHAVIOR OF BLADDER
D499,NEOPLASM OF UNSPECIFIED BEHAVIOR OF UNSPECIFIED SITE
D509,"IRON DEFICIENCY ANEMIA, UNSPECIFIED"
D512,TRANSCOBALAMIN II DEFICIENCY
D528,OTHER FOLATE DEFICIENCY ANEMIAS
D530,PROTEIN DEFICIENCY ANEMIA
D5700,"HB-SS DISEASE WITH CRISIS, UNSPECIFIED"
D5721,SICKLE-CELL/HB-C DISEASE WITH CRISIS
D582,OTHER HEMOGLOBINOPATHIES
D638,ANEMIA IN OTHER CHRONIC DISEASES CLASSIFIED ELSEWHERE
D66,HEREDITARY FACTOR VIII DEFICIENCY
D67,HEREDITARY FACTOR IX DEFICIENCY
D6800,"VON WILLEBRAND DISEASE, UNSPECIFIED"
D6851,ACTIVATED PROTEIN C RESISTANCE
D7218,EOSINOPHILIA IN DISEASES CLASSIFIED ELSEWHERE
D7381,NEUTROPENIC SPLENOMEGALY
D7582,HEPARIN INDUCED THROMBOCYTOPENIA (HIT)
D804,SELECTIVE DEFICIENCY OF IMMUNOGLOBULIN M [IGM]
D829,"IMMUNODEFICIENCY ASSOCIATED WITH MAJOR DEFECT, UNSPECIFIED"
E010,IODINE-DEFICIENCY RELATED DIFFUSE (ENDEMIC) GOITER
E063,AUTOIMMUNE THYROIDITIS
E0801,DIABETES DUE TO UNDERLYING CONDITION W HYPROSM W COMA
E0832,DIABETES DUE TO UNDRL COND W MILD NONPRLF DIABETIC RTNOP
E0861,DIABETES DUE TO UNDERLYING CONDITION W DIABETIC ARTHROPATHY
E1022,TYPE 1 DIABETES MELLITUS W DIABETIC CHRONIC KIDNEY DISEASE
E1039,TYPE 1 DIABETES W OTH DIABETIC OPHTHALMIC COMPLICATION
E1042,TYPE 1 DIABETES MELLITUS WITH DIABETIC POLYNEUROPATHY
E1131,TYPE 2 DIABETES MELLITUS WITH UNSP DIABETIC RETINOPATHY
E1139,TYPE 2 DIABETES W OTH DIABETIC OPHTHALMIC COMPLICATION
E1141,TYPE 2 DIABETES MELLITUS WITH DIABETIC MONONEUROPATHY
E1161,TYPE 2 DIABETES MELLITUS WITH DIABETIC ARTHROPATHY
E1165,TYPE 2 DIABETES MELLITUS WITH HYPERGLYCEMIA
E200,IDIOPATHIC HYPOPARATHYROIDISM
E215,"DISORDER OF PARATHYROID GLAND, UNSPECIFIED"
E2831,PREMATURE MENOPAUSE
E291,TESTICULAR HYPOFUNCTION
E342,"ECTOPIC HORMONE SECRETION, NOT ELSEWHERE CLASSIFIED"
E614,CHROMIUM DEFICIENCY
E669,"OBESITY, UNSPECIFIED"
E7119,OTHER DISORDERS OF BRANCHED-CHAIN AMINO-ACID METABOLISM
E7131,DISORDERS OF FATTY-ACID OXIDATION
E7212,METHYLENETETRAHYDROFOLATE REDUCTASE DEFICIENCY
E7410,"DISORDER OF FRUCTOSE METABOLISM, UNSPECIFIED"
E8349,OTHER DISORDERS OF MAGNESIUM METABOLISM
E8582,WILD-TYPE TRANSTHYRETIN-RELATED (ATTR) AMYLOIDOSIS
E872,ACIDOSIS
E8771,TRANSFUSION ASSOCIATED CIRCULATORY OVERLOAD
F01C2,"VASCULAR DEMENTIA, SEVERE, WITH PSYCHOTIC DISTURBANCE"
F01C4,"VASCULAR DEMENTIA, SEVERE, WITH ANXIETY"
F02B4,"DEM IN OTHER DISEASES CLASSD ELSWHR, MODERATE, WITH ANXIETY"
F03A2,"UNSPECIFIED DEMENTIA, MILD, WITH PSYCHOTIC DISTURBANCE"
F0670,MILD NEUROCOG DISORD D/T KNOWN PHYSIOL COND W/O BEH DISTRB
F1022,ALCOHOL DEPENDENCE WITH INTOXICATION
F1119,OPIOID ABUSE WITH UNSPECIFIED OPIOID-INDUCED DISORDER
F1194,"OPIOID USE, UNSPECIFIED WITH OPIOID-INDUCED MOOD DISORDER"
F1213,CANNABIS ABUSE WITH WITHDRAWAL
F1221,"CANNABIS DEPENDENCE, IN REMISSION"
F1295,"CANNABIS USE, UNSPECIFIED WITH PSYCHOTIC DISORDER"
F1323,"SEDATIVE, HYPNOTIC OR ANXIOLYTIC DEPENDENCE WITH WITHDRAWAL"
F1429,COCAINE DEPENDENCE WITH UNSPECIFIED COCAINE-INDUCED DISORDER
F1494,"COCAINE USE, UNSPECIFIED WITH COCAINE-INDUCED MOOD DISORDER"
F1510,"OTHER STIMULANT ABUSE, UNCOMPLICATED"
F1528,OTH STIMULANT DEPENDENCE WITH OTH STIMULANT-INDUCED DISORDER
F1991,"OTHER PSYCHOACTIVE SUBSTANCE USE, UNSPECIFIED, IN REMISSION"
F1993,"OTHER PSYCHOACTIVE SUBSTANCE USE, UNSP WITH WITHDRAWAL"
F205,RESIDUAL SCHIZOPHRENIA
F3010,"MANIC EPISODE WITHOUT PSYCHOTIC SYMPTOMS, UNSPECIFIED"
F302,"MANIC EPISODE, SEVERE WITH PSYCHOTIC SYMPTOMS"
F3112,"BIPOLAR DISORD, CRNT EPISODE MANIC W/O PSYCH FEATURES, MOD"
F3161,"BIPOLAR DISORDER, CURRENT EPISODE MIXED, MILD"
F321,"MAJOR DEPRESSIVE DISORDER, SINGLE EPISODE, MODERATE"
F341,DYSTHYMIC DISORDER
F39,UNSPECIFIED MOOD [AFFECTIVE] DISORDER
F4023,"BLOOD, INJECTION, INJURY TYPE PHOBIA"
F410,PANIC DISORDER [EPISODIC PAROXYSMAL ANXIETY]
F4381,PROLONGED GRIEF DISORDER
F447,CONVERSION DISORDER WITH MIXED SYMPTOM PRESENTATION
F502,BULIMIA NERVOSA
F5089,OTHER SPECIFIED EATING DISORDER
F5119,OTH HYPERSOMNIA NOT DUE TO A SUBSTANCE OR KNOWN PHYSIOL COND
F659,"PARAPHILIA, UNSPECIFIED"
F70,MILD INTELLECTUAL DISABILITIES
F72,SEVERE INTELLECTUAL DISABILITIES
F78A9,OTHER GENETIC RELATED INTELLECTUAL DISABILITY
F800,PHONOLOGICAL DISORDER
F8081,CHILDHOOD ONSET FLUENCY DISORDER
F845,ASPERGER'S SYNDROME
F901,"ATTN-DEFCT HYPERACTIVITY DISORDER, PREDOM HYPERACTIVE TYPE"
G000,HEMOPHILUS MENINGITIS
G009,"BACTERIAL MENINGITIS, UNSPECIFIED"
G042,"BACTERIAL MENINGOENCEPHALITIS AND MENINGOMYELITIS, NEC"
G112,LATE-ONSET CEREBELLAR ATAXIA
G210,MALIGNANT NEUROLEPTIC SYNDROME
G2401,DRUG INDUCED SUBACUTE DYSKINESIA
G253,MYOCLONUS
G3101,PICK'S DISEASE
G3289,OTH DEGENERATV DISORD OF NERVOUS SYS IN DIS CLASSD ELSWHR
G4089,OTHER SEIZURES
G4310,"MIGRAINE WITH AURA, NOT INTRACTABLE"
G4341,"HEMIPLEGIC MIGRAINE, INTRACTABLE"
G4381,"OTHER MIGRAINE, INTRACTABLE"
G4382,"MENSTRUAL MIGRAINE, NOT INTRACTABLE"
G43A1,"CYCLICAL VOMITING, IN MIGRAINE, INTRACTABLE"
G4431,ACUTE POST-TRAUMATIC HEADACHE
G451,CAROTID ARTERY SYNDROME (HEMISPHERIC)
G4723,"CIRCADIAN RHYTHM SLEEP DISORDER, IRREGULAR SLEEP WAKE TYPE"
G513,CLONIC HEMIFACIAL SPASM
G53,CRANIAL NERVE DISORDERS IN DISEASES CLASSIFIED ELSEWHERE
G55,NERVE ROOT AND PLEXUS COMPRESSIONS IN DISEASES CLASSD ELSWHR
G5600,"CARPAL TUNNEL SYNDROME, UNSPECIFIED UPPER LIMB"
G5681,OTHER SPECIFIED MONONEUROPATHIES OF RIGHT UPPER LIMB
G5700,"LESION OF SCIATIC NERVE, UNSPECIFIED LOWER LIMB"
G5702,"LESION OF SCIATIC NERVE, LEFT LOWER LIMB"
G5740,"LESION OF MEDIAL POPLITEAL NERVE, UNSPECIFIED LOWER LIMB"
G5741,"LESION OF MEDIAL POPLITEAL NERVE, RIGHT LOWER LIMB"
G5783,OTHER SPECIFIED MONONEUROPATHIES OF BILATERAL LOWER LIMBS
G589,"MONONEUROPATHY, UNSPECIFIED"
G601,REFSUM'S DISEASE
G7111,MYOTONIC MUSCULAR DYSTROPHY
G7249,"OTH INFLAMMATORY AND IMMUNE MYOPATHIES, NEC"
G8113,SPASTIC HEMIPLEGIA AFFECTING RIGHT NONDOMINANT SIDE
D8181,BIOTIN-DEPENDENT CARBOXYLASE DEFICIENCY
E7031,OCULAR ALBINISM
F1698,"HALLUCINOGEN USE, UNSP W OTH HALLUCINOGEN-INDUCED DISORDER"
G8253,"QUADRIPLEGIA, C5-C7 COMPLETE"
G835,LOCKED-IN STATE
G890,CENTRAL PAIN SYNDROME
G902,HORNER'S SYNDROME
G9052,COMPLEX REGIONAL PAIN SYNDROME I OF LOWER LIMB
G90A,POSTURAL ORTHOSTATIC TACHYCARDIA SYNDROME [POTS]
G910,COMMUNICATING HYDROCEPHALUS
G911,OBSTRUCTIVE HYDROCEPHALUS
G931,"ANOXIC BRAIN DAMAGE, NOT ELSEWHERE CLASSIFIED"
G9340,"ENCEPHALOPATHY, UNSPECIFIED"
G939,"DISORDER OF BRAIN, UNSPECIFIED"
G9511,ACUTE INFARCTION OF SPINAL CORD (EMBOLIC) (NONEMBOLIC)
G9611,DURAL TEAR
G990,AUTONOMIC NEUROPATHY IN DISEASES CLASSIFIED ELSEWHERE
H0013,"CHALAZION RIGHT EYE, UNSPECIFIED EYELID"
H0233,"BLEPHAROCHALASIS RIGHT EYE, UNSPECIFIED EYELID"
H0259,OTHER DISORDERS AFFECTING EYELID FUNCTION
H0264,XANTHELASMA OF LEFT UPPER EYELID
H0283,DERMATOCHALASIS OF EYELID
H0284,EDEMA OF EYELID
H0288,MEIBOMIAN GLAND DYSFUNCTION OF EYELID
H0420,UNSPECIFIED EPIPHORA
H0533,DEFORMITY OF ORBIT DUE TO TRAUMA OR SURGERY
H1031,"UNSPECIFIED ACUTE CONJUNCTIVITIS, RIGHT EYE"
H1042,SIMPLE CHRONIC CONJUNCTIVITIS
H1081,PINGUECULITIS
H1089,OTHER CONJUNCTIVITIS
H109,UNSPECIFIED CONJUNCTIVITIS
H1131,"CONJUNCTIVAL HEMORRHAGE, RIGHT EYE"
H1589,OTHER DISORDERS OF SCLERA
H1623,NEUROTROPHIC KERATOCONJUNCTIVITIS
H1882,CORNEAL DISORDER DUE TO CONTACT LENS
H1883,RECURRENT EROSION OF CORNEA
H2004,SECONDARY NONINFECTIOUS IRIDOCYCLITIS
H2501,CORTICAL AGE-RELATED CATARACT
H2620,UNSPECIFIED COMPLICATED CATARACT
H2621,CATARACT WITH NEOVASCULARIZATION
H2641,SOEMMERING'S RING
H2649,OTHER SECONDARY CATARACT
H269,UNSPECIFIED CATARACT
H2703,"APHAKIA, BILATERAL"
H2712,ANTERIOR DISLOCATION OF LENS
H3010,UNSPECIFIED DISSEMINATED CHORIORETINAL INFLAMMATION
H3513,"RETINOPATHY OF PREMATURITY, STAGE 2"
H3561,"RETINAL HEMORRHAGE, RIGHT EYE"
H3581,RETINAL EDEMA
H4023,INTERMITTENT ANGLE-CLOSURE GLAUCOMA
H4043,"GLAUCOMA SECONDARY TO EYE INFLAMMATION, BILATERAL"
H4322,"CRYSTALLINE DEPOSITS IN VITREOUS BODY, LEFT EYE"
H4382,VITREOMACULAR ADHESION
H4452,ATROPHY OF GLOBE
H4470,"UNSP RETAINED (OLD) INTRAOCULAR FOREIGN BODY, NONMAGNETIC"
H4710,UNSPECIFIED PAPILLEDEMA
H4753,DISORDERS OF VISUAL PATHWAYS IN (DUE TO) VASCULAR DISORDERS
H4923,"SIXTH [ABDUCENT] NERVE PALSY, BILATERAL"
H4943,"PROGRESSIVE EXTERNAL OPHTHALMOPLEGIA, BILATERAL"
H5011,MONOCULAR EXOTROPIA
H5041,CYCLOTROPIA
H5043,ACCOMMODATIVE COMPONENT IN ESOTROPIA
H5050,UNSPECIFIED HETEROPHORIA
H5122,"INTERNUCLEAR OPHTHALMOPLEGIA, LEFT EYE"
H5222,REGULAR ASTIGMATISM
H5232,ANISEIKONIA
H5312,TRANSIENT VISUAL LOSS
H5330,UNSPECIFIED DISORDER OF BINOCULAR VISION
H5345,OTHER LOCALIZED VISUAL FIELD DEFECT
H5346,HOMONYMOUS BILATERAL FIELD DEFECTS
H5372,IMPAIRED CONTRAST SENSITIVITY
H5410,"BLINDNESS, ONE EYE, LOW VISION OTHER EYE, UNSPECIFIED EYES"
H5700,UNSPECIFIED ANOMALY OF PUPILLARY FUNCTION
H6010,"CELLULITIS OF EXTERNAL EAR, UNSPECIFIED EAR"
H6601,ACUTE SUPPURATIVE OTITIS MEDIA W SPONTANEOUS RUPT EAR DRUM
H6613,"CHRONIC TUBOTYMPANIC SUPPURATIVE OTITIS MEDIA, BILATERAL"
H6980,"OTH DISRD OF EUSTACHIAN TUBE, UNSPECIFIED EAR"
H7012,"CHRONIC MASTOIDITIS, LEFT EAR"
H7090,"UNSPECIFIED MASTOIDITIS, UNSPECIFIED EAR"
H7093,"UNSPECIFIED MASTOIDITIS, BILATERAL"
H7191,"UNSPECIFIED CHOLESTEATOMA, RIGHT EAR"
H7201,"CENTRAL PERFORATION OF TYMPANIC MEMBRANE, RIGHT EAR"
H7492,UNSPECIFIED DISORDER OF LEFT MIDDLE EAR AND MASTOID
H8002,"OTOSCLEROSIS W OVAL WINDOW, NONOBLITERATIVE, LEFT EAR"
H8090,"UNSPECIFIED OTOSCLEROSIS, UNSPECIFIED EAR"
H8109,"MENIERE'S DISEASE, UNSPECIFIED EAR"
H8143,null
H8311,"LABYRINTHINE FISTULA, RIGHT EAR"
H8313,"LABYRINTHINE FISTULA, BILATERAL"
H838X,OTHER SPECIFIED DISEASES OF INNER EAR
H8393,"UNSPECIFIED DISEASE OF INNER EAR, BILATERAL"
H93A9,"PULSATILE TINNITUS, UNSPECIFIED EAR"
I060,RHEUMATIC AORTIC STENOSIS
I10,ESSENTIAL (PRIMARY) HYPERTENSION
I2102,STEMI INVOLVING LEFT ANTERIOR DESCENDING CORONARY ARTERY
I252,OLD MYOCARDIAL INFARCTION
I259,"CHRONIC ISCHEMIC HEART DISEASE, UNSPECIFIED"
I2721,SECONDARY PULMONARY ARTERIAL HYPERTENSION
I2724,CHRONIC THROMBOEMBOLIC PULMONARY HYPERTENSION
I339,"ACUTE AND SUBACUTE ENDOCARDITIS, UNSPECIFIED"
I372,NONRHEUMATIC PULMONARY VALVE STENOSIS WITH INSUFFICIENCY
I38,"ENDOCARDITIS, VALVE UNSPECIFIED"
I420,DILATED CARDIOMYOPATHY
I441,"ATRIOVENTRICULAR BLOCK, SECOND DEGREE"
I4469,OTHER FASCICULAR BLOCK
I468,CARDIAC ARREST DUE TO OTHER UNDERLYING CONDITION
I472,VENTRICULAR TACHYCARDIA
I4721,TORSADES DE POINTES
I492,JUNCTIONAL PREMATURE DEPOLARIZATION
I5081,RIGHT HEART FAILURE
I5089,OTHER HEART FAILURE
I5A,NON-ISCHEMIC MYOCARDIAL INJURY (NON-TRAUMATIC)
I6300,CEREBRAL INFARCTION DUE TO THOMBOS UNSP PRECEREBRAL ARTERY
I6301,CEREBRAL INFARCTION DUE TO THROMBOSIS OF VERTEBRAL ARTERY
I6343,CEREBRAL INFRC DUE TO EMBOLISM OF POSTERIOR CEREBRAL ARTERY
I6344,CEREBRAL INFARCTION DUE TO EMBOLISM OF CEREBELLAR ARTERY
I6601,OCCLUSION AND STENOSIS OF RIGHT MIDDLE CEREBRAL ARTERY
I6609,OCCLUSION AND STENOSIS OF UNSPECIFIED MIDDLE CEREBRAL ARTERY
I6623,OCCLUSION AND STENOSIS OF BI POSTERIOR CEREBRAL ARTERIES
I671,"CEREBRAL ANEURYSM, NONRUPTURED"
I6906,OTH PARALYTIC SYNDROME FOLLOWING NTRM SUBARACH HEMORRHAGE
I6980,UNSPECIFIED SEQUELAE OF OTHER CEREBROVASCULAR DISEASE
I6982,SPEECH/LANG DEFICITS FOLLOWING OTH CEREBROVASCULAR DISEASE
I7061,ATHSCL NONBIOL BYPASS OF THE EXTREMITIES W INTRMT CLAUD
I711,"THORACIC AORTIC ANEURYSM, RUPTURED"
I7143,"INFRARENAL ABDOMINAL AORTIC ANEURYSM, WITHOUT RUPTURE"
I798,"OTH DISORD OF ART,ARTERIOLES & CAPILARE IN DIS CLASSD ELSWHR"
I81,PORTAL VEIN THROMBOSIS
I825Z,CHR EMBLSM AND THOMBOS UNSP DEEP VEINS OF DISTAL LOW EXTRM
I82A1,ACUTE EMBOLISM AND THROMBOSIS OF AXILLARY VEIN
I8300,VARICOSE VEINS OF UNSPECIFIED LOWER EXTREMITY WITH ULCER
I863,VULVAL VARICES
I880,NONSPECIFIC MESENTERIC LYMPHADENITIS
I888,OTHER NONSPECIFIC LYMPHADENITIS
I899,"NONINFECTIVE DISORDER OF LYMPHATIC VESSELS AND NODES, UNSP"
I972,POSTMASTECTOMY LYMPHEDEMA SYNDROME
I9779,OTHER INTRAOPERATIVE CARDIAC FUNCTIONAL DISTURBANCES
I9782,POSTPROCEDURAL CEREBROVASCULAR INFARCTION
J0300,"ACUTE STREPTOCOCCAL TONSILLITIS, UNSPECIFIED"
J060,ACUTE LARYNGOPHARYNGITIS
J069,"ACUTE UPPER RESPIRATORY INFECTION, UNSPECIFIED"
J09X2,FLU DUE TO IDENT NOVEL INFLUENZA A VIRUS W OTH RESP MANIFEST
J1281,PNEUMONIA DUE TO SARS-ASSOCIATED CORONAVIRUS
J1282,PNEUMONIA DUE TO CORONAVIRUS DISEASE 2019
J204,ACUTE BRONCHITIS DUE TO PARAINFLUENZA VIRUS
J331,POLYPOID SINUS DEGENERATION
J3489,OTHER SPECIFIED DISORDERS OF NOSE AND NASAL SINUSES
J351,HYPERTROPHY OF TONSILS
J359,"CHRONIC DISEASE OF TONSILS AND ADENOIDS, UNSPECIFIED"
J36,PERITONSILLAR ABSCESS
J42,UNSPECIFIED CHRONIC BRONCHITIS
J45,ASTHMA
J4531,MILD PERSISTENT ASTHMA WITH (ACUTE) EXACERBATION
J4551,SEVERE PERSISTENT ASTHMA WITH (ACUTE) EXACERBATION
J632,BERYLLIOSIS
J851,ABSCESS OF LUNG WITH PNEUMONIA
J948,OTHER SPECIFIED PLEURAL CONDITIONS
J9692,"RESPIRATORY FAILURE, UNSPECIFIED WITH HYPERCAPNIA"
K007,TEETHING SYNDROME
K011,IMPACTED TEETH
K027,DENTAL ROOT CARIES
K0402,IRREVERSIBLE PULPITIS
K0530,"CHRONIC PERIODONTITIS, UNSPECIFIED"
K062,GINGIVAL & EDENTULOUS ALVEOLAR RIDGE LESIONS ASSOC W TRAUMA
K0810,"COMPLETE LOSS OF TEETH, UNSPECIFIED CAUSE"
K083,RETAINED DENTAL ROOT
K0842,PARTIAL LOSS OF TEETH DUE TO PERIODONTAL DISEASES
K110,ATROPHY OF SALIVARY GLAND
K113,ABSCESS OF SALIVARY GLAND
K1233,ORAL MUCOSITIS (ULCERATIVE) DUE TO RADIATION
K1329,"OTHER DISTURBANCES OF ORAL EPITHELIUM, INCLUDING TONGUE"
K149,"DISEASE OF TONGUE, UNSPECIFIED"
K2090,"ESOPHAGITIS, UNSPECIFIED WITHOUT BLEEDING"
K257,CHRONIC GASTRIC ULCER WITHOUT HEMORRHAGE OR PERFORATION
K262,ACUTE DUODENAL ULCER WITH BOTH HEMORRHAGE AND PERFORATION
K283,ACUTE GASTROJEJUNAL ULCER WITHOUT HEMORRHAGE OR PERFORATION
K2930,CHRONIC SUPERFICIAL GASTRITIS WITHOUT BLEEDING
K2940,CHRONIC ATROPHIC GASTRITIS WITHOUT BLEEDING
K2980,DUODENITIS WITHOUT BLEEDING
K3182,DIEULAFOY LESION (HEMORRHAGIC) OF STOMACH AND DUODENUM
K381,APPENDICULAR CONCRETIONS
K4041,"UNILATERAL INGUINAL HERNIA, WITH GANGRENE, RECURRENT"
K429,UMBILICAL HERNIA WITHOUT OBSTRUCTION OR GANGRENE
K435,PARASTOMAL HERNIA WITHOUT OBSTRUCTION OR GANGRENE
K469,UNSPECIFIED ABDOMINAL HERNIA WITHOUT OBSTRUCTION OR GANGRENE
K5229,OTHER ALLERGIC AND DIETETIC GASTROENTERITIS AND COLITIS
K5283,MICROSCOPIC COLITIS
K529,"NONINFECTIVE GASTROENTERITIS AND COLITIS, UNSPECIFIED"
K5700,DVTRCLI OF SM INT W PERFORATION AND ABSCESS W/O BLEEDING
K592,"NEUROGENIC BOWEL, NOT ELSEWHERE CLASSIFIED"
K601,CHRONIC ANAL FISSURE
K603,ANAL FISTULA
K623,RECTAL PROLAPSE
K6389,OTHER SPECIFIED DISEASES OF INTESTINE
K645,PERIANAL VENOUS THROMBOSIS
K700,ALCOHOLIC FATTY LIVER
K710,TOXIC LIVER DISEASE WITH CHOLESTASIS
K713,TOXIC LIVER DISEASE WITH CHRONIC PERSISTENT HEPATITIS
K7291,"HEPATIC FAILURE, UNSPECIFIED WITH COMA"
K7581,NONALCOHOLIC STEATOHEPATITIS (NASH)
K8043,CALCULUS OF BILE DUCT W ACUTE CHOLECYSTITIS WITH OBSTRUCTION
K8045,CALCULUS OF BILE DUCT W CHRONIC CHOLECYSTITIS W OBSTRUCTION
K8061,"CALCULUS OF GB AND BILE DUCT W CHOLECYST, UNSP, W OBST"
K824,CHOLESTEROLOSIS OF GALLBLADDER
K830,CHOLANGITIS
K861,OTHER CHRONIC PANCREATITIS
K8689,OTHER SPECIFIED DISEASES OF PANCREAS
K901,TROPICAL SPRUE
K9409,OTHER COMPLICATIONS OF COLOSTOMY
L00,STAPHYLOCOCCAL SCALDED SKIN SYNDROME
L0211,CUTANEOUS ABSCESS OF NECK
L0221,CUTANEOUS ABSCESS OF TRUNK
L0302,ACUTE LYMPHANGITIS OF FINGER
L0311,CELLULITIS OF OTHER PARTS OF LIMB
L0882,OMPHALITIS NOT OF NEWBORN
L1230,"ACQUIRED EPIDERMOLYSIS BULLOSA, UNSPECIFIED"
L24A2,"IRRITANT CNTCT DERM D/T FECAL, URINRY OR DUAL INCONTINENCE"
L254,UNSP CONTACT DERMATITIS DUE TO FOOD IN CONTACT WITH SKIN
L4051,DISTAL INTERPHALANGEAL PSORIATIC ARTHROPATHY
L4054,PSORIATIC JUVENILE ARTHROPATHY
L501,IDIOPATHIC URTICARIA
L551,SUNBURN OF SECOND DEGREE
L563,SOLAR URTICARIA
L569,"ACUTE SKIN CHANGE DUE TO ULTRAVIOLET RADIATION, UNSPECIFIED"
L605,YELLOW NAIL SYNDROME
L648,OTHER ANDROGENIC ALOPECIA
L680,HIRSUTISM
L722,STEATOCYSTOMA MULTIPLEX
L728,OTHER FOLLICULAR CYSTS OF THE SKIN AND SUBCUTANEOUS TISSUE
L7632,"POSTPROC HEMATOMA OF SKIN, SUBCU FOLLOWING OTHER PROCEDURE"
L859,"EPIDERMAL THICKENING, UNSPECIFIED"
L8941,"PRESSR ULCER OF CONTIG SITE OF BACK, BUTTOCK AND HIP, STG 1"
L8995,"PRESSURE ULCER OF UNSPECIFIED SITE, UNSTAGEABLE"
L919,"HYPERTROPHIC DISORDER OF THE SKIN, UNSPECIFIED"
L922,GRANULOMA FACIALE [EOSINOPHILIC GRANULOMA OF SKIN]
L948,OTHER SPECIFIED LOCALIZED CONNECTIVE TISSUE DISORDERS
L980,PYOGENIC GRANULOMA
L985,MUCINOSIS OF THE SKIN
M0004,"STAPHYLOCOCCAL ARTHRITIS, HAND"
M0280,"OTHER REACTIVE ARTHROPATHIES, UNSPECIFIED SITE"
M0500,"FELTY'S SYNDROME, UNSPECIFIED SITE"
M0562,RHEUMATOID ARTHRITIS OF ELBOW W INVOLV OF ORGANS AND SYSTEMS
M0564,RHEUMATOID ARTHRITIS OF HAND W INVOLV OF ORGANS AND SYSTEMS
M0565,RHEUMATOID ARTHRITIS OF HIP W INVOLV OF ORGANS AND SYSTEMS
M0579,RHEU ARTHRITIS W RHEU FACTOR MULT SITE W/O ORG/SYS INVOLV
M060A,"RHEUMATOID ARTHRITIS WITHOUT RHEUMATOID FACTOR, OTH SITE"
M0683,"OTHER SPECIFIED RHEUMATOID ARTHRITIS, WRIST"
M0684,"OTHER SPECIFIED RHEUMATOID ARTHRITIS, HAND"
M0809,"UNSPECIFIED JUVENILE RHEUMATOID ARTHRITIS, MULTIPLE SITES"
M0889,"OTHER JUVENILE ARTHRITIS, MULTIPLE SITES"
M1001,"IDIOPATHIC GOUT, SHOULDER"
M1004,"IDIOPATHIC GOUT, HAND"
M1210,"KASCHIN-BECK DISEASE, UNSPECIFIED SITE"
M1289,"OTH SPECIFIC ARTHROPATHIES, NEC, MULTIPLE SITES"
M1310,"MONOARTHRITIS, NOT ELSEWHERE CLASSIFIED, UNSPECIFIED SITE"
M1383,"OTHER SPECIFIED ARTHRITIS, WRIST"
M1488,"ARTHROPATHIES IN OTH DISEASES CLASSD ELSWHR, VERTEBRAE"
M189,"OSTEOARTHRITIS OF FIRST CARPOMETACARPAL JOINT, UNSPECIFIED"
M1901,"PRIMARY OSTEOARTHRITIS, SHOULDER"
M1992,"POST-TRAUMATIC OSTEOARTHRITIS, UNSPECIFIED SITE"
M2011,"HALLUX VALGUS (ACQUIRED), RIGHT FOOT"
M2040,"OTHER HAMMER TOE(S) (ACQUIRED), UNSPECIFIED FOOT"
M2042,"OTHER HAMMER TOE(S) (ACQUIRED), LEFT FOOT"
M2110,"VARUS DEFORMITY, NOT ELSEWHERE CLASSIFIED, UNSPECIFIED SITE"
M2180,OTHER SPECIFIED ACQUIRED DEFORMITIES OF UNSPECIFIED LIMB
M2331,"OTH MENISCUS DERANGEMENTS, ANTERIOR HORN OF MEDIAL MENISCUS"
M2451,"CONTRACTURE, SHOULDER"
M2454,"CONTRACTURE, HAND"
M2501,"HEMARTHROSIS, SHOULDER"
M2536,"OTHER INSTABILITY, KNEE"
M2550,PAIN IN UNSPECIFIED JOINT
M2553,PAIN IN WRIST
M2556,PAIN IN KNEE
M2565,"STIFFNESS OF HIP, NOT ELSEWHERE CLASSIFIED"
M2572,"OSTEOPHYTE, ELBOW"
M2581,"OTHER SPECIFIED JOINT DISORDERS, SHOULDER"
M2657,LACK OF POSTERIOR OCCLUSAL SUPPORT
M2660,"TEMPOROMANDIBULAR JOINT DISORDER, UNSPECIFIED"
M269,"DENTOFACIAL ANOMALY, UNSPECIFIED"
M2749,OTHER CYSTS OF JAW
M316,OTHER GIANT CELL ARTERITIS
M317,MICROSCOPIC POLYANGIITIS
M3390,"DERMATOPOLYMYOSITIS, UNSP, ORGAN INVOLVEMENT UNSPECIFIED"
M340,PROGRESSIVE SYSTEMIC SCLEROSIS
M3505,SJOGREN SYNDROME WITH INFLAMMATORY ARTHRITIS
M4005,"POSTURAL KYPHOSIS, THORACOLUMBAR REGION"
M4014,"OTHER SECONDARY KYPHOSIS, THORACIC REGION"
M4020,UNSPECIFIED KYPHOSIS
M4037,"FLATBACK SYNDROME, LUMBOSACRAL REGION"
M4056,"LORDOSIS, UNSPECIFIED, LUMBAR REGION"
M4057,"LORDOSIS, UNSPECIFIED, LUMBOSACRAL REGION"
M4120,"OTHER IDIOPATHIC SCOLIOSIS, SITE UNSPECIFIED"
M4130,"THORACOGENIC SCOLIOSIS, SITE UNSPECIFIED"
M4150,"OTHER SECONDARY SCOLIOSIS, SITE UNSPECIFIED"
M4183,"OTHER FORMS OF SCOLIOSIS, CERVICOTHORACIC REGION"
M4302,"SPONDYLOLYSIS, CERVICAL REGION"
M4305,"SPONDYLOLYSIS, THORACOLUMBAR REGION"
M438X,OTHER SPECIFIED DEFORMING DORSOPATHIES
M456,ANKYLOSING SPONDYLITIS LUMBAR REGION
M45A6,NON-RADIOGRAPHIC AXIAL SPONDYLOARTHRITIS OF LUMBAR REGION
M4623,"OSTEOMYELITIS OF VERTEBRA, CERVICOTHORACIC REGION"
M4628,"OSTEOMYELITIS OF VERTEBRA, SACRAL AND SACROCOCCYGEAL REGION"
M4642,"DISCITIS, UNSPECIFIED, CERVICAL REGION"
M4647,"DISCITIS, UNSPECIFIED, LUMBOSACRAL REGION"
M4656,"OTHER INFECTIVE SPONDYLOPATHIES, LUMBAR REGION"
M4682,"OTH INFLAMMATORY SPONDYLOPATHIES, CERVICAL REGION"
M4684,"OTH INFLAMMATORY SPONDYLOPATHIES, THORACIC REGION"
M4688,"OTH INFLAMMATORY SPONDYLOPATHIES, SACR/SACROCYGL REGION"
M4692,"UNSPECIFIED INFLAMMATORY SPONDYLOPATHY, CERVICAL REGION"
M4714,"OTHER SPONDYLOSIS WITH MYELOPATHY, THORACIC REGION"
M4826,"KISSING SPINE, LUMBAR REGION"
M4857,"COLLAPSED VERTEBRA, NEC, LUMBOSACRAL REGION"
M5083,"OTHER CERVICAL DISC DISORDERS, CERVICOTHORACIC REGION"
M5135,"OTHER INTERVERTEBRAL DISC DEGENERATION, THORACOLUMBAR REGION"
M5144,"SCHMORL'S NODES, THORACIC REGION"
M5145,"SCHMORL'S NODES, THORACOLUMBAR REGION"
M5384,"OTHER SPECIFIED DORSOPATHIES, THORACIC REGION"
M5407,"PANNICULITIS AFFECTING REGIONS OF NECK/BK, LUMBOSACR REGION"
M5410,"RADICULOPATHY, SITE UNSPECIFIED"
M5412,"RADICULOPATHY, CERVICAL REGION"
M6007,"INFECTIVE MYOSITIS, ANKLE, FOOT AND TOES"
M6220,"NONTRAUMATIC ISCHEMIC INFARCTION OF MUSCLE, UNSPECIFIED SITE"
M6244,"CONTRACTURE OF MUSCLE, HAND"
M6247,"CONTRACTURE OF MUSCLE, ANKLE AND FOOT"
M6281,MUSCLE WEAKNESS (GENERALIZED)
M6283,MUSCLE SPASM
M6581,"OTHER SYNOVITIS AND TENOSYNOVITIS, SHOULDER"
