CODE,DESCRIPTION
Z1503,GENETIC SUSCEPTIBILITY TO MALIGNANT NEOPLASM OF PROSTATE
Z1589,GENETIC SUSCEPTIBILITY TO OTHER DISEASE
Z1611,RESISTANCE TO PENICILLINS
Z1623,RESISTANCE TO QUINOLONES AND FLUOROQUINOLONES
Z170,ESTROGEN RECEPTOR POSITIVE STATUS [ER+]
Z1811,RETAINED MAGNETIC METAL FRAGMENTS
Z227,LATENT TUBERCULOSIS
Z2889,IMMUNIZATION NOT CARRIED OUT FOR OTHER REASON
Z2911,ENCTR FOR PRPHYLC IMMTHER FOR RESP SYNCYTIAL VIRUS (RSV)
Z3169,ENCOUNTER FOR OTH GENERAL CNSL AND ADVICE ON PROCREATION
Z3183,ENCOUNTER FOR ASSISTED REPRODCTV FERTILITY PROCEDURE CYCLE
Z363,ENCOUNTER FOR ANTENATAL SCREENING FOR MALFORMATIONS
Z3687,ENCOUNTER FOR ANTENATAL SCREENING FOR UNCERTAIN DATES
Z372,"TWINS, BOTH LIVEBORN"
Z4421,ENCOUNTER FOR FITTING AND ADJUSTMENT OF ARTIFICIAL RIGHT EYE
Z4542,ENCOUNTER FOR ADJUSTMENT AND MANAGEMENT OF NEUROSTIMULATOR
Z463,ENCOUNTER FOR FIT/ADJST OF DENTAL PROSTHETIC DEVICE
Z4789,ENCOUNTER FOR OTHER ORTHOPEDIC AFTERCARE
Z4801,ENCOUNTER FOR CHANGE OR REMOVAL OF SURGICAL WOUND DRESSING
Z577,OCCUPATIONAL EXPOSURE TO VIBRATION
Z578,OCCUPATIONAL EXPOSURE TO OTHER RISK FACTORS
Z609,"PROBLEM RELATED TO SOCIAL ENVIRONMENT, UNSPECIFIED"
Z631,PROBLEMS IN RELATIONSHIP WITH IN-LAWS
Z6822,"BODY MASS INDEX [BMI] 22.0-22.9, ADULT"
Z6854,"BODY MASS INDEX PEDIATRIC, > OR EQUAL TO 95% FOR AGE"
Z736,LIMITATION OF ACTIVITIES DUE TO DISABILITY
Z750,MEDICAL SERVICES NOT AVAILABLE IN HOME
Z765,MALINGERER [CONSCIOUS SIMULATION]
Z7711,CONTACT W AND (SUSPECTED) EXPOSURE TO ENVIRON POLLUTION
Z794,LONG TERM (CURRENT) USE OF INSULIN
Z7962,LONG TERM (CURRENT) USE OF IMMUNOSUPPRESSANT
Z800,FAMILY HISTORY OF MALIGNANT NEOPLASM OF DIGESTIVE ORGANS
Z8043,FAMILY HISTORY OF MALIGNANT NEOPLASM OF TESTIS
Z8049,FAMILY HISTORY OF MALIGNANT NEOPLASM OF OTHER GENITAL ORGANS
Z8051,FAMILY HISTORY OF MALIGNANT NEOPLASM OF KIDNEY
Z807,"FAM HX OF MALIG NEOPLM OF LYMPHOID, HEMATPOETC AND REL TISS"
Z821,FAMILY HISTORY OF BLINDNESS AND VISUAL LOSS
Z8351,FAMILY HISTORY OF EYE DISORDERS
Z8550,PERSONAL HISTORY OF MALIG NEOPLM OF UNSP URINARY TRACT ORGAN
Z8659,PERSONAL HISTORY OF OTHER MENTAL AND BEHAVIORAL DISORDERS
Z8661,PERSONAL HISTORY OF INFECTIONS OF THE CENTRAL NERVOUS SYSTEM
Z8669,PERSONAL HISTORY OF DIS OF THE NERVOUS SYS AND SENSE ORGANS
Z8719,PERSONAL HISTORY OF OTHER DISEASES OF THE DIGESTIVE SYSTEM
Z8789,PERSONAL HISTORY OF OTHER SPECIFIED CONDITIONS
Z8922,ACQUIRED ABSENCE OF UPPER LIMB ABOVE ELBOW
Z899,"ACQUIRED ABSENCE OF LIMB, UNSPECIFIED"
Z9011,ACQUIRED ABSENCE OF RIGHT BREAST AND NIPPLE
Z9102,FOOD ADDITIVES ALLERGY STATUS
Z9111,PATIENT'S NONCOMPLIANCE WITH DIETARY REGIMEN
Z9114,PATIENT'S OTHER NONCOMPLIANCE WITH MEDICATION REGIMEN
Z9183,WANDERING IN DISEASES CLASSIFIED ELSEWHERE
Z9282,S/P ADMN TPA IN DIFF FAC W/N LAST 24 HR BEF ADM TO CRNT FAC
Z930,TRACHEOSTOMY STATUS
Z936,OTHER ARTIFICIAL OPENINGS OF URINARY TRACT STATUS
Z9481,BONE MARROW TRANSPLANT STATUS
Z9484,STEM CELLS TRANSPLANT STATUS
Z953,PRESENCE OF XENOGENIC HEART VALVE
Z960,PRESENCE OF UROGENITAL IMPLANTS
Z9662,PRESENCE OF ARTIFICIAL ELBOW JOINT
Z9689,PRESENCE OF OTHER SPECIFIED FUNCTIONAL IMPLANTS
Z9861,CORONARY ANGIOPLASTY STATUS
Z9862,PERIPHERAL VASCULAR ANGIOPLASTY STATUS
Z9881,DENTAL PROCEDURE STATUS
S8691,STRAIN OF UNSPECIFIED MUSCLE AND TENDON AT LOWER LEG LEVEL
A021,SALMONELLA SEPSIS
A041,ENTEROTOXIGENIC ESCHERICHIA COLI INFECTION
A4101,SEPSIS DUE TO METHICILLIN SUSCEPTIBLE STAPHYLOCOCCUS AUREUS
A4150,"GRAM-NEGATIVE SEPSIS, UNSPECIFIED"
A4153,SEPSIS DUE TO SERRATIA
A419,"SEPSIS, UNSPECIFIED ORGANISM"
A492,"HEMOPHILUS INFLUENZAE INFECTION, UNSPECIFIED SITE"
A498,OTHER BACTERIAL INFECTIONS OF UNSPECIFIED SITE
A5131,CONDYLOMA LATUM
A539,"SYPHILIS, UNSPECIFIED"
A5400,"GONOCOCCAL INFECTION OF LOWER GENITOURINARY TRACT, UNSP"
A5903,TRICHOMONAL CYSTITIS AND URETHRITIS
A6001,HERPESVIRAL INFECTION OF PENIS
A638,OTHER SPECIFIED PREDOMINANTLY SEXUALLY TRANSMITTED DISEASES
A681,TICK-BORNE RELAPSING FEVER
A6922,OTHER NEUROLOGIC DISORDERS IN LYME DISEASE
A799,"RICKETTSIOSIS, UNSPECIFIED"
A819,"ATYPICAL VIRUS INFECTION OF CENTRAL NERVOUS SYSTEM, UNSP"
B000,ECZEMA HERPETICUM
B0189,OTHER VARICELLA COMPLICATIONS
B0224,POSTHERPETIC MYELITIS
B1710,ACUTE HEPATITIS C WITHOUT HEPATIC COMA
B369,"SUPERFICIAL MYCOSIS, UNSPECIFIED"
B370,CANDIDAL STOMATITIS
B373,CANDIDIASIS OF VULVA AND VAGINA
B3783,CANDIDAL CHEILITIS
B392,"PULMONARY HISTOPLASMOSIS CAPSULATI, UNSPECIFIED"
B4481,ALLERGIC BRONCHOPULMONARY ASPERGILLOSIS
B49,UNSPECIFIED MYCOSIS
B582,TOXOPLASMA MENINGOENCEPHALITIS
B719,"CESTODE INFECTION, UNSPECIFIED"
B80,ENTEROBIASIS
B839,"HELMINTHIASIS, UNSPECIFIED"
B9721,SARS-ASSOCIATED CORONAVIRUS CAUSING DISEASES CLASSD ELSWHR
C040,MALIGNANT NEOPLASM OF ANTERIOR FLOOR OF MOUTH
C140,"MALIGNANT NEOPLASM OF PHARYNX, UNSPECIFIED"
C181,MALIGNANT NEOPLASM OF APPENDIX
C241,MALIGNANT NEOPLASM OF AMPULLA OF VATER
C259,"MALIGNANT NEOPLASM OF PANCREAS, UNSPECIFIED"
C300,MALIGNANT NEOPLASM OF NASAL CAVITY
C328,MALIGNANT NEOPLASM OF OVERLAPPING SITES OF LARYNX
C4372,"MALIGNANT MELANOMA OF LEFT LOWER LIMB, INCLUDING HIP"
C438,MALIGNANT MELANOMA OF OVERLAPPING SITES OF SKIN
C4401,BASAL CELL CARCINOMA OF SKIN OF LIP
C4420,UNSP MALIGNANT NEOPLASM SKIN/ EAR AND EXTERNAL AURIC CANAL
C4441,BASAL CELL CARCINOMA OF SKIN OF SCALP AND NECK
C467,KAPOSI'S SARCOMA OF OTHER SITES
C469,"KAPOSI'S SARCOMA, UNSPECIFIED"
C4920,"MALIG NEOPLM OF CONN AND SOFT TISS OF UNSP LOW LIMB, INC HIP"
C49A0,"GASTROINTESTINAL STROMAL TUMOR, UNSPECIFIED SITE"
C518,MALIGNANT NEOPLASM OF OVERLAPPING SITES OF VULVA
C538,MALIGNANT NEOPLASM OF OVERLAPPING SITES OF CERVIX UTERI
C6291,"MALIG NEOPLM OF RIGHT TESTIS, UNSP DESCENDED OR UNDESCENDED"
C662,MALIGNANT NEOPLASM OF LEFT URETER
C678,MALIGNANT NEOPLASM OF OVERLAPPING SITES OF BLADDER
C700,MALIGNANT NEOPLASM OF CEREBRAL MENINGES
C701,MALIGNANT NEOPLASM OF SPINAL MENINGES
C7490,MALIGNANT NEOPLASM OF UNSP PART OF UNSPECIFIED ADRENAL GLAND
C763,MALIGNANT NEOPLASM OF PELVIS
C7801,SECONDARY MALIGNANT NEOPLASM OF RIGHT LUNG
C7932,SECONDARY MALIGNANT NEOPLASM OF CEREBRAL MENINGES
C7A1,MALIGNANT POORLY DIFFERENTIATED NEUROENDOCRINE TUMORS
C7B03,SECONDARY CARCINOID TUMORS OF BONE
C8101,"NODLR LYMPHOCY PREDOM HDGKN LYMPH, NODES OF HEAD, FACE, & NK"
C8111,"NODULAR SCLER HODGKIN LYMPH, NODES OF HEAD, FACE, AND NECK"
C8309,"SMALL CELL B-CELL LYMPHOMA, EXTRANODAL AND SOLID ORGAN SITES"
C8310,"MANTLE CELL LYMPHOMA, UNSPECIFIED SITE"
C8339,"DIFFUSE LARGE B-CELL LYMPHOMA, EXTRNOD AND SOLID ORGAN SITES"
C8583,"OTH TYPES OF NON-HODGKIN LYMPHOMA, INTRA-ABD LYMPH NODES"
C8595,"NON-HODG LYMPHOMA, UNSP, NODES OF ING REGION AND LOWER LIMB"
C91Z0,OTHER LYMPHOID LEUKEMIA NOT HAVING ACHIEVED REMISSION
C9241,"ACUTE PROMYELOCYTIC LEUKEMIA, IN REMISSION"
C9290,"MYELOID LEUKEMIA, UNSPECIFIED, NOT HAVING ACHIEVED REMISSION"
C9291,"MYELOID LEUKEMIA, UNSPECIFIED IN REMISSION"
C9311,"CHRONIC MYELOMONOCYTIC LEUKEMIA, IN REMISSION"
C946,"MYELODYSPLASTIC DISEASE, NOT ELSEWHERE CLASSIFIED"
D0006,CARCINOMA IN SITU OF FLOOR OF MOUTH
D011,CARCINOMA IN SITU OF RECTOSIGMOID JUNCTION
D0321,MELANOMA IN SITU OF RIGHT EAR AND EXTERNAL AURICULAR CANAL
D0352,MELANOMA IN SITU OF BREAST (SKIN) (SOFT TISSUE)
D0372,"MELANOMA IN SITU OF LEFT LOWER LIMB, INCLUDING HIP"
D044,CARCINOMA IN SITU OF SKIN OF SCALP AND NECK
D0510,INTRADUCTAL CARCINOMA IN SITU OF UNSPECIFIED BREAST
D0511,INTRADUCTAL CARCINOMA IN SITU OF RIGHT BREAST
D0581,OTHER SPECIFIED TYPE OF CARCINOMA IN SITU OF RIGHT BREAST
D100,BENIGN NEOPLASM OF LIP
D105,BENIGN NEOPLASM OF OTHER PARTS OF OROPHARYNX
D120,BENIGN NEOPLASM OF CECUM
D123,BENIGN NEOPLASM OF TRANSVERSE COLON
D128,BENIGN NEOPLASM OF RECTUM
D139,BENIGN NEOPLASM OF ILL-DEFINED SITES WITHIN THE DGSTV SYS
D1432,BENIGN NEOPLASM OF LEFT BRONCHUS AND LUNG
D1612,BENIGN NEOPLASM OF SHORT BONES OF LEFT UPPER LIMB
D164,BENIGN NEOPLASM OF BONES OF SKULL AND FACE
D165,BENIGN NEOPLASM OF LOWER JAW BONE
D166,BENIGN NEOPLASM OF VERTEBRAL COLUMN
D2120,"BEN NEOPLM OF CONNCTV/SOFT TISS OF UNSP LOWER LIMB, INC HIP"
D216,"BENIGN NEOPLASM OF CONNCTV/SOFT TISS OF TRUNK, UNSP"
D2221,MELANOCYTIC NEVI OF RIGHT EAR AND EXTERNAL AURICULAR CANAL
D2272,"MELANOCYTIC NEVI OF LEFT LOWER LIMB, INCLUDING HIP"
D234,OTHER BENIGN NEOPLASM OF SKIN OF SCALP AND NECK
D2361,"OTH BENIGN NEOPLASM SKIN/ RIGHT UPPER LIMB, INC SHOULDER"
D2372,"OTH BENIGN NEOPLASM SKIN/ LEFT LOWER LIMB, INCLUDING HIP"
D239,"OTHER BENIGN NEOPLASM OF SKIN, UNSPECIFIED"
D3101,BENIGN NEOPLASM OF RIGHT CONJUNCTIVA
D3611,BEN NEOPLM OF PRPH NERVES AND AUTONM NRV SYS OF FACE/HED/NK
D3614,BENIGN NEOPLM OF PRPH NERVES AND AUTONM NRV SYS OF THORAX
D4102,NEOPLASM OF UNCERTAIN BEHAVIOR OF LEFT KIDNEY
D434,NEOPLASM OF UNCERTAIN BEHAVIOR OF SPINAL CORD
D447,NEOPLASM OF UNCRT BEHAV OF AORTIC BODY AND OTH PARAGANGLIA
D4620,"REFRACTORY ANEMIA WITH EXCESS OF BLASTS, UNSPECIFIED"
D469,"MYELODYSPLASTIC SYNDROME, UNSPECIFIED"
D474,OSTEOMYELOFIBROSIS
D47Z9,"OTH NEOPLM OF UNCRT BEHAV OF LYMPHOID, HEMATPOETC & REL TISS"
D4861,NEOPLASM OF UNCERTAIN BEHAVIOR OF RIGHT BREAST
D511,VIT B12 DEFIC ANEMIA D/T SLCTV VIT B12 MALABSORP W PROTEIN
D531,"OTHER MEGALOBLASTIC ANEMIAS, NOT ELSEWHERE CLASSIFIED"
D561,BETA THALASSEMIA
D5911,WARM AUTOIMMUNE HEMOLYTIC ANEMIA
D594,OTHER NONAUTOIMMUNE HEMOLYTIC ANEMIAS
D599,"ACQUIRED HEMOLYTIC ANEMIA, UNSPECIFIED"
D611,DRUG-INDUCED APLASTIC ANEMIA
D6941,EVANS SYNDROME
D801,NONFAMILIAL HYPOGAMMAGLOBULINEMIA
D809,"IMMUNODEFICIENCY WITH PREDOMINANTLY ANTIBODY DEFECTS, UNSP"
D823,IMMUNODEF FOL HEREDIT DEFCTV RESPONSE TO EPSTEIN-BARR VIRUS
D830,COM VARIAB IMMUNODEF W PREDOM ABNLT OF B-CELL NUMS & FUNCTN
D8482,IMMUNODEFICIENCY DUE TO DRUGS AND EXTERNAL CAUSES
E012,"IODINE-DEFICIENCY RELATED (ENDEMIC) GOITER, UNSPECIFIED"
E049,"NONTOXIC GOITER, UNSPECIFIED"
E060,ACUTE THYROIDITIS
E065,OTHER CHRONIC THYROIDITIS
E1035,TYPE 1 DIABETES W PROLIFERATIVE DIABETIC RETINOPATHY
E1149,TYPE 2 DIABETES W OTH DIABETIC NEUROLOGICAL COMPLICATION
E1310,OTH DIABETES MELLITUS WITH KETOACIDOSIS WITHOUT COMA
E1342,OTH DIABETES MELLITUS WITH DIABETIC POLYNEUROPATHY
E249,"CUSHING'S SYNDROME, UNSPECIFIED"
E270,OTHER ADRENOCORTICAL OVERACTIVITY
E2839,OTHER PRIMARY OVARIAN FAILURE
E309,"DISORDER OF PUBERTY, UNSPECIFIED"
E319,"POLYGLANDULAR DYSFUNCTION, UNSPECIFIED"
E343,SHORT STATURE DUE TO ENDOCRINE DISORDER
E507,OTHER OCULAR MANIFESTATIONS OF VITAMIN A DEFICIENCY
E508,OTHER MANIFESTATIONS OF VITAMIN A DEFICIENCY
E568,DEFICIENCY OF OTHER VITAMINS
E610,COPPER DEFICIENCY
E673,HYPERVITAMINOSIS D
E678,OTHER SPECIFIED HYPERALIMENTATION
E7132,DISORDERS OF KETONE METABOLISM
E7143,IATROGENIC CARNITINE DEFICIENCY
E7211,HOMOCYSTINURIA
E738,OTHER LACTOSE INTOLERANCE
E769,"GLUCOSAMINOGLYCAN METABOLISM DISORDER, UNSPECIFIED"
E782,MIXED HYPERLIPIDEMIA
E7871,BARTH SYNDROME
E7889,OTHER LIPOPROTEIN METABOLISM DISORDERS
E789,"DISORDER OF LIPOPROTEIN METABOLISM, UNSPECIFIED"
E799,"DISORDER OF PURINE AND PYRIMIDINE METABOLISM, UNSPECIFIED"
E8332,HEREDITARY VITAMIN D-DEPENDENT RICKETS (TYPE 1) (TYPE 2)
E8342,HYPOMAGNESEMIA
E839,"DISORDER OF MINERAL METABOLISM, UNSPECIFIED"
E851,NEUROPATHIC HEREDOFAMILIAL AMYLOIDOSIS
E853,SECONDARY SYSTEMIC AMYLOIDOSIS
E854,ORGAN-LIMITED AMYLOIDOSIS
E8721,ACUTE METABOLIC ACIDOSIS
E8940,ASYMPTOMATIC POSTPROCEDURAL OVARIAN FAILURE
F0281,"DEM IN OTHER DIS CLASSD ELSWHR, UNSP SEV, WITH BEH DISTRB"
F03C2,"UNSPECIFIED DEMENTIA, SEVERE, WITH PSYCHOTIC DISTURBANCE"
F0631,MOOD DISORDER DUE TO KNOWN PHYSIOL COND W DEPRESSV FEATURES
F068,OTH MENTAL DISORDERS DUE TO KNOWN PHYSIOLOGICAL CONDITION
F070,PERSONALITY CHANGE DUE TO KNOWN PHYSIOLOGICAL CONDITION
F1019,ALCOHOL ABUSE WITH UNSPECIFIED ALCOHOL-INDUCED DISORDER
F1090,"ALCOHOL USE, UNSPECIFIED, UNCOMPLICATED"
F1191,"OPIOID USE, UNSPECIFIED, IN REMISSION"
F1229,CANNABIS DEPENDENCE WITH UNSP CANNABIS-INDUCED DISORDER
F1312,"SEDATIVE, HYPNOTIC OR ANXIOLYTIC ABUSE WITH INTOXICATION"
F1398,"SEDATIVE, HYPNOTIC OR ANXIOLYTIC USE, UNSP W OTH DISORDERS"
F1413,"COCAINE ABUSE, UNSPECIFIED WITH WITHDRAWAL"
F1424,COCAINE DEPENDENCE WITH COCAINE-INDUCED MOOD DISORDER
F1514,OTHER STIMULANT ABUSE WITH STIMULANT-INDUCED MOOD DISORDER
F1525,OTH STIMULANT DEPENDENCE W STIM-INDUCE PSYCHOTIC DISORDER
F1729,"NICOTINE DEPENDENCE, OTHER TOBACCO PRODUCT"
F1920,"OTHER PSYCHOACTIVE SUBSTANCE DEPENDENCE, UNCOMPLICATED"
F1994,"OTH PSYCHOACTIVE SUBSTANCE USE, UNSP W MOOD DISORDER"
F1995,"OTH PSYCHOACTIVE SUBSTANCE USE, UNSP W PSYCHOTIC DISORDER"
F258,OTHER SCHIZOAFFECTIVE DISORDERS
F3171,"BIPOLAR DISORD, IN PARTIAL REMIS, MOST RECENT EPSD HYPOMANIC"
F3341,"MAJOR DEPRESSIVE DISORDER, RECURRENT, IN PARTIAL REMISSION"
F3342,"MAJOR DEPRESSIVE DISORDER, RECURRENT, IN FULL REMISSION"
F4021,ANIMAL TYPE PHOBIA
F4312,"POST-TRAUMATIC STRESS DISORDER, CHRONIC"
F446,CONVERSION DISORDER WITH SENSORY SYMPTOM OR DEFICIT
F4521,HYPOCHONDRIASIS
F458,OTHER SOMATOFORM DISORDERS
F488,OTHER SPECIFIED NONPSYCHOTIC MENTAL DISORDERS
F489,"NONPSYCHOTIC MENTAL DISORDER, UNSPECIFIED"
F509,"EATING DISORDER, UNSPECIFIED"
F530,POSTPARTUM DEPRESSION
F552,ABUSE OF LAXATIVES
F632,KLEPTOMANIA
F908,"ATTENTION-DEFICIT HYPERACTIVITY DISORDER, OTHER TYPE"
F984,STEREOTYPED MOVEMENT DISORDERS
G1119,OTHER EARLY-ONSET CEREBELLAR ATAXIA
G1223,PRIMARY LATERAL SCLEROSIS
G1229,OTHER MOTOR NEURON DISEASE
G219,"SECONDARY PARKINSONISM, UNSPECIFIED"
G244,IDIOPATHIC OROFACIAL DYSTONIA
G2571,DRUG INDUCED AKATHISIA
G309,"ALZHEIMER'S DISEASE, UNSPECIFIED"
G3183,NEUROCOGNITIVE DISORDER WITH LEWY BODIES
G35,MULTIPLE SCLEROSIS
G40,EPILEPSY AND RECURRENT SEIZURES
G4082,EPILEPTIC SPASMS
G43A0,"CYCLICAL VOMITING, IN MIGRAINE, NOT INTRACTABLE"
G4409,OTHER TRIGEMINAL AUTONOMIC CEPHALGIAS (TAC)
G4483,PRIMARY COUGH HEADACHE
G4709,OTHER INSOMNIA
G4713,RECURRENT HYPERSOMNIA
G4721,"CIRCADIAN RHYTHM SLEEP DISORDER, DELAYED SLEEP PHASE TYPE"
G4752,REM SLEEP BEHAVIOR DISORDER
G519,"DISORDER OF FACIAL NERVE, UNSPECIFIED"
G5601,"CARPAL TUNNEL SYNDROME, RIGHT UPPER LIMB"
G5603,"CARPAL TUNNEL SYNDROME, BILATERAL UPPER LIMBS"
G5680,OTHER SPECIFIED MONONEUROPATHIES OF UNSPECIFIED UPPER LIMB
G5701,"LESION OF SCIATIC NERVE, RIGHT LOWER LIMB"
G5753,"TARSAL TUNNEL SYNDROME, BILATERAL LOWER LIMBS"
G5780,OTHER SPECIFIED MONONEUROPATHIES OF UNSPECIFIED LOWER LIMB
G63,POLYNEUROPATHY IN DISEASES CLASSIFIED ELSEWHERE
G651,SEQUELAE OF OTHER INFLAMMATORY POLYNEUROPATHY
G7000,MYASTHENIA GRAVIS WITHOUT (ACUTE) EXACERBATION
G7102,FACIOSCAPULOHUMERAL MUSCULAR DYSTROPHY
G7109,OTHER SPECIFIED MUSCULAR DYSTROPHIES
G729,"MYOPATHY, UNSPECIFIED"
G800,SPASTIC QUADRIPLEGIC CEREBRAL PALSY
G8322,MONOPLEGIA OF UPPER LIMB AFFECTING LEFT DOMINANT SIDE
G8381,BROWN-SEQUARD SYNDROME
G8921,CHRONIC PAIN DUE TO TRAUMA
G928,OTHER TOXIC ENCEPHALOPATHY
G935,COMPRESSION OF BRAIN
G9600,"CEREBROSPINAL FLUID LEAK, UNSPECIFIED"
G9689,OTHER SPECIFIED DISORDERS OF CENTRAL NERVOUS SYSTEM
G9781,OTHER INTRAOPERATIVE COMPLICATIONS OF NERVOUS SYSTEM
H0100,UNSPECIFIED BLEPHARITIS
H0113,ECZEMATOUS DERMATITIS OF EYELID
H0203,SENILE ENTROPION OF EYELID
H0210,UNSPECIFIED ECTROPION OF EYELID
H0240,UNSPECIFIED PTOSIS OF EYELID
H0243,PARALYTIC PTOSIS OF EYELID
H0263,"XANTHELASMA OF RIGHT EYE, UNSPECIFIED EYELID"
H1012,"ACUTE ATOPIC CONJUNCTIVITIS, LEFT EYE"
H1021,ACUTE TOXIC CONJUNCTIVITIS
H1122,CONJUNCTIVAL GRANULOMA
H1132,"CONJUNCTIVAL HEMORRHAGE, LEFT EYE"
H1144,CONJUNCTIVAL CYSTS
H1710,"CENTRAL CORNEAL OPACITY, UNSPECIFIED EYE"
H1781,MINOR OPACITY OF CORNEA
G20B2,"PARKINSON'S DISEASE WITH DYSKINESIA, WITH FLUCTUATIONS"
G20C,"PARKINSONISM, UNSPECIFIED"
H1830,UNSPECIFIED CORNEAL MEMBRANE CHANGE
H1840,UNSPECIFIED CORNEAL DEGENERATION
H1853,GRANULAR CORNEAL DYSTROPHY
H1854,LATTICE CORNEAL DYSTROPHY
H211X,OTHER VASCULAR DISORDERS OF IRIS AND CILIARY BODY
H2129,OTHER IRIS ATROPHY
H2130,"IDIOPATHIC CYSTS OF IRIS, CILIARY BODY OR ANTERIOR CHAMBER"
H3023,"POSTERIOR CYCLITIS, BILATERAL"
H3090,"UNSPECIFIED CHORIORETINAL INFLAMMATION, UNSPECIFIED EYE"
H3121,CHOROIDEREMIA
H3402,"TRANSIENT RETINAL ARTERY OCCLUSION, LEFT EYE"
H3501,CHANGES IN RETINAL VASCULAR APPEARANCE
H4001,"OPEN ANGLE WITH BORDERLINE FINDINGS, LOW RISK"
H4011,PRIMARY OPEN-ANGLE GLAUCOMA
H4041,"GLAUCOMA SECONDARY TO EYE INFLAMMATION, RIGHT EYE"
H4422,"DEGENERATIVE MYOPIA, LEFT EYE"
H4423,"DEGENERATIVE MYOPIA, BILATERAL"
H4441,FLAT ANTERIOR CHAMBER HYPOTONY OF EYE
H463,TOXIC OPTIC NEUROPATHY
H4903,"THIRD [OCULOMOTOR] NERVE PALSY, BILATERAL"
H4940,"PROGRESSIVE EXTERNAL OPHTHALMOPLEGIA, UNSPECIFIED EYE"
H5053,VERTICAL HETEROPHORIA
H5089,OTHER SPECIFIED STRABISMUS
H510,PALSY (SPASM) OF CONJUGATE GAZE
H5112,CONVERGENCE EXCESS
H5123,"INTERNUCLEAR OPHTHALMOPLEGIA, BILATERAL"
H526,OTHER DISORDERS OF REFRACTION
H5301,DEPRIVATION AMBLYOPIA
H5303,STRABISMIC AMBLYOPIA
H5333,SIMULTANEOUS VISUAL PERCEPTION WITHOUT FUSION
H5347,HETERONYMOUS BILATERAL FIELD DEFECTS
H5348,GENERALIZED CONTRACTION OF VISUAL FIELD
H5411,"BLINDNESS, RIGHT EYE, LOW VISION LEFT EYE"
H5462,"UNQUALIFIED VISUAL LOSS, LEFT EYE, NORMAL VISION RIGHT EYE"
H547,UNSPECIFIED VISUAL LOSS
H5502,LATENT NYSTAGMUS
H5702,ANISOCORIA
H579,UNSPECIFIED DISORDER OF EYE AND ADNEXA
H6039,OTHER INFECTIVE OTITIS EXTERNA
H6042,CHOLESTEATOMA OF LEFT EXTERNAL EAR
H6531,"CHRONIC MUCOID OTITIS MEDIA, RIGHT EAR"
H6532,"CHRONIC MUCOID OTITIS MEDIA, LEFT EAR"
H6691,"OTITIS MEDIA, UNSPECIFIED, RIGHT EAR"
H673,"OTITIS MEDIA IN DISEASES CLASSIFIED ELSEWHERE, BILATERAL"
H6983,"OTHER SPECIFIED DISORDERS OF EUSTACHIAN TUBE, BILATERAL"
H7010,"CHRONIC MASTOIDITIS, UNSPECIFIED EAR"
H7013,"CHRONIC MASTOIDITIS, BILATERAL"
H7091,"UNSPECIFIED MASTOIDITIS, RIGHT EAR"
H7111,"CHOLESTEATOMA OF TYMPANUM, RIGHT EAR"
H7313,"CHRONIC MYRINGITIS, BILATERAL"
H7320,"UNSPECIFIED MYRINGITIS, UNSPECIFIED EAR"
H7402,"TYMPANOSCLEROSIS, LEFT EAR"
H7411,ADHESIVE RIGHT MIDDLE EAR DISEASE
H7441,POLYP OF RIGHT MIDDLE EAR
H8112,"BENIGN PAROXYSMAL VERTIGO, LEFT EAR"
H8123,"VESTIBULAR NEURONITIS, BILATERAL"
H814,VERTIGO OF CENTRAL ORIGIN
H8142,null
H818X,OTHER DISORDERS OF VESTIBULAR FUNCTION
H8193,"UNSPECIFIED DISORDER OF VESTIBULAR FUNCTION, BILATERAL"
H823,"VERTIGINOUS SYNDROMES IN DISEASES CLASSD ELSWHR, BILATERAL"
H8309,"LABYRINTHITIS, UNSPECIFIED EAR"
H903,"SENSORINEURAL HEARING LOSS, BILATERAL"
H9120,"SUDDEN IDIOPATHIC HEARING LOSS, UNSPECIFIED EAR"
H9222,"OTORRHAGIA, LEFT EAR"
H9301,TRANSIENT ISCHEMIC DEAFNESS
H9311,"TINNITUS, RIGHT EAR"
H9324,TEMPORARY AUDITORY THRESHOLD SHIFT
I052,RHEUMATIC MITRAL STENOSIS WITH INSUFFICIENCY
I062,RHEUMATIC AORTIC STENOSIS WITH INSUFFICIENCY
I068,OTHER RHEUMATIC AORTIC VALVE DISEASES
I2109,STEMI INVOLVING OTH CORONARY ARTERY OF ANTERIOR WALL
I2129,STEMI INVOLVING OTH SITES
I219,"ACUTE MYOCARDIAL INFARCTION, UNSPECIFIED"
I221,SUBSEQUENT STEMI OF INFERIOR WALL
I232,VENTRICULAR SEPTAL DEFECT AS CURRENT COMP FOLLOWING AMI
I301,INFECTIVE PERICARDITIS
I3131,MALIGNANT PERICARDIAL EFFUSION IN DISEASES CLASSD ELSWHR
I319,"DISEASE OF PERICARDIUM, UNSPECIFIED"
I341,NONRHEUMATIC MITRAL (VALVE) PROLAPSE
I371,NONRHEUMATIC PULMONARY VALVE INSUFFICIENCY
I39,ENDOCARDITIS AND HEART VALVE DISORD IN DIS CLASSD ELSWHR
I450,RIGHT FASCICULAR BLOCK
I4510,UNSPECIFIED RIGHT BUNDLE-BRANCH BLOCK
I456,PRE-EXCITATION SYNDROME
I462,CARDIAC ARREST DUE TO UNDERLYING CARDIAC CONDITION
I493,VENTRICULAR PREMATURE DEPOLARIZATION
I5042,CHRONIC COMBINED SYSTOLIC AND DIASTOLIC HRT FAIL
I5084,END STAGE HEART FAILURE
I514,"MYOCARDITIS, UNSPECIFIED"
I610,"NONTRAUMATIC INTCRBL HEMORRHAGE IN HEMISPHERE, SUBCORTICAL"
I614,NONTRAUMATIC INTRACEREBRAL HEMORRHAGE IN CEREBELLUM
I616,"NONTRAUMATIC INTRACEREBRAL HEMORRHAGE, MULTIPLE LOCALIZED"
I618,OTHER NONTRAUMATIC INTRACEREBRAL HEMORRHAGE
I6201,NONTRAUMATIC ACUTE SUBDURAL HEMORRHAGE
I621,NONTRAUMATIC EXTRADURAL HEMORRHAGE
I6303,CEREBRAL INFARCTION DUE TO THROMBOSIS OF CAROTID ARTERY
I6310,CEREBRAL INFARCTION DUE TO EMBOLISM OF UNSP PRECERB ARTERY
I6321,CEREBRAL INFRC DUE TO UNSP OCCLS OR STENOSIS OF VERTEB ART
I6351,CEREB INFRC DUE TO UNSP OCCLS OR STENOS OF MIDDLE CEREB ART
I636,"CEREBRAL INFRC DUE TO CEREBRAL VENOUS THOMBOS, NONPYOGENIC"
I6502,OCCLUSION AND STENOSIS OF LEFT VERTEBRAL ARTERY
I6611,OCCLUSION AND STENOSIS OF RIGHT ANTERIOR CEREBRAL ARTERY
I6621,OCCLUSION AND STENOSIS OF RIGHT POSTERIOR CEREBRAL ARTERY
I675,MOYAMOYA DISEASE
I679,"CEREBROVASCULAR DISEASE, UNSPECIFIED"
I6909,OTHER SEQUELAE OF NONTRAUMATIC SUBARACHNOID HEMORRHAGE
I6915,HEMIPLGA FOLLOWING NONTRAUMATIC INTRACEREBRAL HEMORRHAGE
I7030,UNSP ATHSCL UNSP TYPE BYPASS GRAFT(S) OF THE EXTREMITIES
I7142,"JUXTARENAL ABDOMINAL AORTIC ANEURYSM, WITHOUT RUPTURE"
I7160,"THORACOABDOMINAL AORTIC ANEURYSM, WITHOUT RUPTURE, UNSP"
I721,ANEURYSM OF ARTERY OF UPPER EXTREMITY
I725,ANEURYSM OF OTHER PRECEREBRAL ARTERIES
I781,"NEVUS, NON-NEOPLASTIC"
I789,"DISEASE OF CAPILLARIES, UNSPECIFIED"
I8013,"PHLEBITIS AND THROMBOPHLEBITIS OF FEMORAL VEIN, BILATERAL"
I8021,PHLEBITIS AND THROMBOPHLEBITIS OF ILIAC VEIN
I8381,VARICOSE VEINS OF LOWER EXTREMITIES WITH PAIN
I8393,ASYMPTOMATIC VARICOSE VEINS OF BILATERAL LOWER EXTREMITIES
I8700,POSTTHROMBOTIC SYNDROME WITHOUT COMPLICATIONS
I8703,POSTTHROMBOTIC SYNDROME WITH ULCER AND INFLAMMATION
I872,VENOUS INSUFFICIENCY (CHRONIC) (PERIPHERAL)
I8731,CHRONIC VENOUS HYPERTENSION (IDIOPATHIC) WITH ULCER
I898,OTH NONINFECTIVE DISORDERS OF LYMPHATIC VESSELS AND NODES
I973,POSTPROCEDURAL HYPERTENSION
I9751,ACC PNCTR & LAC OF A CIRC SYS ORG DURING A CIRC SYS PROC
J00,ACUTE NASOPHARYNGITIS [COMMON COLD]
J0110,"ACUTE FRONTAL SINUSITIS, UNSPECIFIED"
J0390,"ACUTE TONSILLITIS, UNSPECIFIED"
J040,ACUTE LARYNGITIS
J0411,ACUTE TRACHEITIS WITH OBSTRUCTION
J0430,"SUPRAGLOTTITIS, UNSPECIFIED, WITHOUT OBSTRUCTION"
J1001,FLU DUE TO OTH IDENT FLU VIRUS W SAME OTH IDENT FLU VIRUS PN
J1100,FLU DUE TO UNIDENTIFIED FLU VIRUS W UNSP TYPE OF PNEUMONIA
J1521,PNEUMONIA DUE TO STAPHYLOCOCCUS AUREUS
J189,"PNEUMONIA, UNSPECIFIED ORGANISM"
J206,ACUTE BRONCHITIS DUE TO RHINOVIRUS
J218,ACUTE BRONCHIOLITIS DUE TO OTHER SPECIFIED ORGANISMS
J3481,NASAL MUCOSITIS (ULCERATIVE)
J349,UNSPECIFIED DISORDER OF NOSE AND NASAL SINUSES
J3503,CHRONIC TONSILLITIS AND ADENOIDITIS
J385,LARYNGEAL SPASM
J440,CHR OBSTRUCTIVE PULMON DISEASE WITH (ACUTE) LOWER RESP INFCT
J64,UNSPECIFIED PNEUMOCONIOSIS
J705,RESPIRATORY CONDITIONS DUE TO SMOKE INHALATION
J9581,POSTPROCEDURAL PNEUMOTHORAX AND AIR LEAK
J9582,POSTPROCEDURAL RESPIRATORY FAILURE
J9602,ACUTE RESPIRATORY FAILURE WITH HYPERCAPNIA
J9612,CHRONIC RESPIRATORY FAILURE WITH HYPERCAPNIA
K0381,CRACKED TOOTH
K0511,"CHRONIC GINGIVITIS, NON-PLAQUE INDUCED"
K0812,COMPLETE LOSS OF TEETH DUE TO PERIODONTAL DISEASES
K0841,PARTIAL LOSS OF TEETH DUE TO TRAUMA
K122,CELLULITIS AND ABSCESS OF MOUTH
K1230,"ORAL MUCOSITIS (ULCERATIVE), UNSPECIFIED"
K1370,UNSPECIFIED LESIONS OF ORAL MUCOSA
K140,GLOSSITIS
K141,GEOGRAPHIC TONGUE
K225,"DIVERTICULUM OF ESOPHAGUS, ACQUIRED"
K2282,ESOPHAGOGASTRIC JUNCTION POLYP
K272,"ACUTE PEPTIC ULCER, SITE UNSP, W BOTH HEMORRHAGE AND PERF"
K280,ACUTE GASTROJEJUNAL ULCER WITH HEMORRHAGE
K287,CHRONIC GASTROJEJUNAL ULCER W/O HEMORRHAGE OR PERFORATION
K289,"GASTROJEJUNAL ULCER, UNSP AS ACUTE OR CHR, W/O HEMOR OR PERF"
K2931,CHRONIC SUPERFICIAL GASTRITIS WITH BLEEDING
K2941,CHRONIC ATROPHIC GASTRITIS WITH BLEEDING
K315,OBSTRUCTION OF DUODENUM
K3181,ANGIODYSPLASIA OF STOMACH AND DUODENUM
K31A0,"GASTRIC INTESTINAL METAPLASIA, UNSPECIFIED"
K5011,CROHN'S DISEASE OF LARGE INTESTINE WITH COMPLICATIONS
K5081,CROHN'S DISEASE OF BOTH SMALL AND LG INT W COMPLICATIONS
K5091,"CROHN'S DISEASE, UNSPECIFIED, WITH COMPLICATIONS"
K5150,LEFT SIDED COLITIS WITHOUT COMPLICATIONS
K5151,LEFT SIDED COLITIS WITH COMPLICATIONS
K5641,FECAL IMPACTION
K5733,DVTRCLI OF LG INT W/O PERFORATION OR ABSCESS W BLEEDING
K5780,"DVTRCLI OF INTEST, PART UNSP, W PERF AND ABSCESS W/O BLEED"
K591,FUNCTIONAL DIARRHEA
K627,RADIATION PROCTITIS
K632,FISTULA OF INTESTINE
K6381,DIEULAFOY LESION OF INTESTINE
K648,OTHER HEMORRHOIDS
K653,CHOLEPERITONITIS
K712,TOXIC LIVER DISEASE WITH ACUTE HEPATITIS
K716,"TOXIC LIVER DISEASE WITH HEPATITIS, NOT ELSEWHERE CLASSIFIED"
K7401,"HEPATIC FIBROSIS, EARLY FIBROSIS"
K8041,"CALCULUS OF BILE DUCT W CHOLECYSTITIS, UNSP, W OBSTRUCTION"
K8042,CALCULUS OF BILE DUCT W ACUTE CHOLECYSTITIS W/O OBSTRUCTION
K8044,CALCULUS OF BILE DUCT W CHRONIC CHOLECYST W/O OBSTRUCTION
K823,FISTULA OF GALLBLADDER
K82A2,PERFORATION OF GALLBLADDER IN CHOLECYSTITIS
K835,BILIARY CYST
K8512,BILIARY ACUTE PANCREATITIS WITH INFECTED NECROSIS
K8530,DRUG INDUCED ACUTE PANCREATITIS WITHOUT NECROSIS OR INFCT
K9049,"MALABSORPTION DUE TO INTOLERANCE, NOT ELSEWHERE CLASSIFIED"
K9509,OTHER COMPLICATIONS OF GASTRIC BAND PROCEDURE
K9589,OTHER COMPLICATIONS OF OTHER BARIATRIC PROCEDURE
L0100,"IMPETIGO, UNSPECIFIED"
L0101,NON-BULLOUS IMPETIGO
L0109,OTHER IMPETIGO
L0292,"FURUNCLE, UNSPECIFIED"
L0303,CELLULITIS OF TOE
L0331,CELLULITIS OF TRUNK
L0390,"CELLULITIS, UNSPECIFIED"
L0592,PILONIDAL SINUS WITHOUT ABSCESS
L0889,OTH LOCAL INFECTIONS OF THE SKIN AND SUBCUTANEOUS TISSUE
L100,PEMPHIGUS VULGARIS
L102,PEMPHIGUS FOLIACEOUS
L209,"ATOPIC DERMATITIS, UNSPECIFIED"
L2481,IRRITANT CONTACT DERMATITIS DUE TO METALS
L298,OTHER PRURITUS
L305,PITYRIASIS ALBA
L4059,OTHER PSORIATIC ARTHROPATHY
L413,SMALL PLAQUE PARAPSORIASIS
L430,HYPERTROPHIC LICHEN PLANUS
L432,LICHENOID DRUG REACTION
L502,URTICARIA DUE TO COLD AND HEAT
L530,TOXIC ERYTHEMA
L539,"ERYTHEMATOUS CONDITION, UNSPECIFIED"
L651,ANAGEN EFFLUVIUM
L661,LICHEN PLANOPILARIS
L663,PERIFOLLICULITIS CAPITIS ABSCEDENS
L710,PERIORAL DERMATITIS
L723,SEBACEOUS CYST
L739,"FOLLICULAR DISORDER, UNSPECIFIED"
L80,VITILIGO
L853,XEROSIS CUTIS
L8900,PRESSURE ULCER OF UNSPECIFIED ELBOW
L8944,"PRESSR ULCER OF CONTIG SITE OF BACK, BUTTOCK AND HIP, STG 4"
L8962,PRESSURE ULCER OF LEFT HEEL
L8993,"PRESSURE ULCER OF UNSPECIFIED SITE, STAGE 3"
L900,LICHEN SCLEROSUS ET ATROPHICUS
M0000,"STAPHYLOCOCCAL ARTHRITIS, UNSPECIFIED JOINT"
M0002,"STAPHYLOCOCCAL ARTHRITIS, ELBOW"
M049,"AUTOINFLAMMATORY SYNDROME, UNSPECIFIED"
M069,"RHEUMATOID ARTHRITIS, UNSPECIFIED"
M0890,"JUVENILE ARTHRITIS, UNSPECIFIED, UNSPECIFIED SITE"
M1032,"GOUT DUE TO RENAL IMPAIRMENT, ELBOW"
M1034,"GOUT DUE TO RENAL IMPAIRMENT, HAND"
M1120,"OTHER CHONDROCALCINOSIS, UNSPECIFIED SITE"
M1129,"OTHER CHONDROCALCINOSIS, MULTIPLE SITES"
M1285,"OTHER SPECIFIC ARTHROPATHIES, NOT ELSEWHERE CLASSIFIED, HIP"
