CODE,DESCRIPTION
A084,"VIRAL INTESTINAL INFECTION, UNSPECIFIED"
A408,OTHER STREPTOCOCCAL SEPSIS
A4102,SEPSIS DUE TO METHICILLIN RESISTANT STAPHYLOCOCCUS AUREUS
A420,PULMONARY ACTINOMYCOSIS
A448,OTHER FORMS OF BARTONELLOSIS
A4902,"METHICILLIN RESIS STAPH INFECTION, UNSP SITE"
A493,"MYCOPLASMA INFECTION, UNSPECIFIED SITE"
A509,"CONGENITAL SYPHILIS, UNSPECIFIED"
A528,"LATE SYPHILIS, LATENT"
A5401,"GONOCOCCAL CYSTITIS AND URETHRITIS, UNSPECIFIED"
A5402,"GONOCOCCAL VULVOVAGINITIS, UNSPECIFIED"
A546,GONOCOCCAL INFECTION OF ANUS AND RECTUM
A599,"TRICHOMONIASIS, UNSPECIFIED"
A879,"VIRAL MENINGITIS, UNSPECIFIED"
A90,DENGUE FEVER [CLASSICAL DENGUE]
A9231,WEST NILE VIRUS INFECTION WITH ENCEPHALITIS
B001,HERPESVIRAL VESICULAR DERMATITIS
B078,OTHER VIRAL WARTS
B085,ENTEROVIRAL VESICULAR PHARYNGITIS
B1910,UNSPECIFIED VIRAL HEPATITIS B WITHOUT HEPATIC COMA
B1911,UNSPECIFIED VIRAL HEPATITIS B WITH HEPATIC COMA
B1921,UNSPECIFIED VIRAL HEPATITIS C WITH HEPATIC COMA
B2789,OTHER INFECTIOUS MONONUCLEOSIS WITH OTHER COMPLICATION
B372,CANDIDIASIS OF SKIN AND NAIL
B3742,CANDIDAL BALANITIS
B3781,CANDIDAL ESOPHAGITIS
B400,ACUTE PULMONARY BLASTOMYCOSIS
B4489,OTHER FORMS OF ASPERGILLOSIS
B600,BABESIOSIS
B941,SEQUELAE OF VIRAL ENCEPHALITIS
B9622,OTH SHIGA TOXIN E COLI [STEC] CAUSING DISEASES CLASSD ELSWHR
B9689,OTH BACTERIAL AGENTS AS THE CAUSE OF DISEASES CLASSD ELSWHR
C020,MALIGNANT NEOPLASM OF DORSAL SURFACE OF TONGUE
C060,MALIGNANT NEOPLASM OF CHEEK MUCOSA
C098,MALIGNANT NEOPLASM OF OVERLAPPING SITES OF TONSIL
C139,"MALIGNANT NEOPLASM OF HYPOPHARYNX, UNSPECIFIED"
C187,MALIGNANT NEOPLASM OF SIGMOID COLON
C189,"MALIGNANT NEOPLASM OF COLON, UNSPECIFIED"
C23,MALIGNANT NEOPLASM OF GALLBLADDER
C258,MALIGNANT NEOPLASM OF OVERLAPPING SITES OF PANCREAS
C3411,"MALIGNANT NEOPLASM OF UPPER LOBE, RIGHT BRONCHUS OR LUNG"
C3431,"MALIGNANT NEOPLASM OF LOWER LOBE, RIGHT BRONCHUS OR LUNG"
C3432,"MALIGNANT NEOPLASM OF LOWER LOBE, LEFT BRONCHUS OR LUNG"
C4311,"MALIGNANT MELANOMA OF RIGHT EYELID, INCLUDING CANTHUS"
C434,MALIGNANT MELANOMA OF SCALP AND NECK
C4402,SQUAMOUS CELL CARCINOMA OF SKIN OF LIP
C4422,SQUAMOUS CELL CARCINOMA SKIN/ EAR AND EXTERNAL AURIC CANAL
C4462,"SQUAMOUS CELL CARCINOMA SKIN/ UPPER LIMB, INCLUDING SHOULDER"
C4921,"MALIG NEOPLM OF CONN AND SOFT TISS OF R LOW LIMB, INC HIP"
C578,MALIGNANT NEOPLASM OF OVRLP SITES OF FEMALE GENITAL ORGANS
C6211,MALIGNANT NEOPLASM OF DESCENDED RIGHT TESTIS
C6212,MALIGNANT NEOPLASM OF DESCENDED LEFT TESTIS
C680,MALIGNANT NEOPLASM OF URETHRA
C761,MALIGNANT NEOPLASM OF THORAX
C770,"SEC AND UNSP MALIG NEOPLASM OF NODES OF HEAD, FACE AND NECK"
C778,SEC AND UNSP MALIG NEOPLASM OF NODES OF MULTIPLE REGIONS
C7800,SECONDARY MALIGNANT NEOPLASM OF UNSPECIFIED LUNG
C786,SECONDARY MALIGNANT NEOPLASM OF RETROPERITON AND PERITONEUM
C7900,SECONDARY MALIGNANT NEOPLASM OF UNSP KIDNEY AND RENAL PELVIS
C7919,SECONDARY MALIGNANT NEOPLASM OF OTHER URINARY ORGANS
C7931,SECONDARY MALIGNANT NEOPLASM OF BRAIN
C7961,SECONDARY MALIGNANT NEOPLASM OF RIGHT OVARY
C7A09,MALIGNANT CARCINOID TUMORS OF OTHER SITES
C801,"MALIGNANT (PRIMARY) NEOPLASM, UNSPECIFIED"
C8100,"NODULAR LYMPHOCYTE PREDOMINANT HODGKIN LYMPHOMA, UNSP SITE"
C8198,"HODGKIN LYMPHOMA, UNSPECIFIED, LYMPH NODES OF MULTIPLE SITES"
C8213,"FOLLICULAR LYMPHOMA GRADE II, INTRA-ABDOMINAL LYMPH NODES"
C8239,"FOLICLAR LYMPHOMA GRADE IIIA, EXTRNOD AND SOLID ORGAN SITES"
C8240,"FOLLICULAR LYMPHOMA GRADE IIIB, UNSPECIFIED SITE"
C8290,"FOLLICULAR LYMPHOMA, UNSPECIFIED, UNSPECIFIED SITE"
C8294,"FOLLICULAR LYMPHOMA, UNSP, NODES OF AXILLA AND UPPER LIMB"
C8303,"SMALL CELL B-CELL LYMPHOMA, INTRA-ABDOMINAL LYMPH NODES"
C8330,"DIFFUSE LARGE B-CELL LYMPHOMA, UNSPECIFIED SITE"
C8350,"LYMPHOBLASTIC (DIFFUSE) LYMPHOMA, UNSPECIFIED SITE"
C8512,"UNSPECIFIED B-CELL LYMPHOMA, INTRATHORACIC LYMPH NODES"
C8591,"NON-HODGKIN LYMPHOMA, UNSP, NODES OF HEAD, FACE, AND NECK"
C880,WALDENSTROM MACROGLOBULINEMIA
D0000,"CARCINOMA IN SITU OF ORAL CAVITY, UNSPECIFIED SITE"
D0008,CARCINOMA IN SITU OF PHARYNX
D012,CARCINOMA IN SITU OF RECTUM
D0330,MELANOMA IN SITU OF UNSPECIFIED PART OF FACE
D0362,"MELANOMA IN SITU OF LEFT UPPER LIMB, INCLUDING SHOULDER"
D0472,"CARCINOMA IN SITU OF SKIN OF LEFT LOWER LIMB, INCLUDING HIP"
D0500,LOBULAR CARCINOMA IN SITU OF UNSPECIFIED BREAST
D1030,BENIGN NEOPLASM OF UNSPECIFIED PART OF MOUTH
D1620,BENIGN NEOPLASM OF LONG BONES OF UNSPECIFIED LOWER LIMB
D1802,HEMANGIOMA OF INTRACRANIAL STRUCTURES
D1809,HEMANGIOMA OF OTHER SITES
D201,BENIGN NEOPLASM OF SOFT TISSUE OF PERITONEUM
D2371,"OTH BENIGN NEOPLASM SKIN/ RIGHT LOWER LIMB, INCLUDING HIP"
D251,INTRAMURAL LEIOMYOMA OF UTERUS
D3001,BENIGN NEOPLASM OF RIGHT KIDNEY
D3102,BENIGN NEOPLASM OF LEFT CONJUNCTIVA
D3112,BENIGN NEOPLASM OF LEFT CORNEA
D3132,BENIGN NEOPLASM OF LEFT CHOROID
D330,"BENIGN NEOPLASM OF BRAIN, SUPRATENTORIAL"
D332,"BENIGN NEOPLASM OF BRAIN, UNSPECIFIED"
D3502,BENIGN NEOPLASM OF LEFT ADRENAL GLAND
D360,BENIGN NEOPLASM OF LYMPH NODES
D3610,"BENIGN NEOPLASM OF PRPH NERVES AND AUTONM NERVOUS SYS, UNSP"
D383,NEOPLASM OF UNCERTAIN BEHAVIOR OF MEDIASTINUM
D390,NEOPLASM OF UNCERTAIN BEHAVIOR OF UTERUS
D4010,NEOPLASM OF UNCERTAIN BEHAVIOR OF UNSPECIFIED TESTIS
D4110,NEOPLASM OF UNCERTAIN BEHAVIOR OF UNSPECIFIED RENAL PELVIS
D4121,NEOPLASM OF UNCERTAIN BEHAVIOR OF RIGHT URETER
D430,"NEOPLASM OF UNCERTAIN BEHAVIOR OF BRAIN, SUPRATENTORIAL"
D4411,NEOPLASM OF UNCERTAIN BEHAVIOR OF RIGHT ADRENAL GLAND
D442,NEOPLASM OF UNCERTAIN BEHAVIOR OF PARATHYROID GLAND
D443,NEOPLASM OF UNCERTAIN BEHAVIOR OF PITUITARY GLAND
D47Z2,CASTLEMAN DISEASE
D485,NEOPLASM OF UNCERTAIN BEHAVIOR OF SKIN
D4862,NEOPLASM OF UNCERTAIN BEHAVIOR OF LEFT BREAST
D489,"NEOPLASM OF UNCERTAIN BEHAVIOR, UNSPECIFIED"
D500,IRON DEFICIENCY ANEMIA SECONDARY TO BLOOD LOSS (CHRONIC)
D593,HEMOLYTIC-UREMIC SYNDROME
D595,PAROXYSMAL NOCTURNAL HEMOGLOBINURIA [MARCHIAFAVA-MICHELI]
D613,IDIOPATHIC APLASTIC ANEMIA
D6189,OTH APLASTIC ANEMIAS AND OTHER BONE MARROW FAILURE SYNDROMES
D62,ACUTE POSTHEMORRHAGIC ANEMIA
D630,ANEMIA IN NEOPLASTIC DISEASE
D6859,OTHER PRIMARY THROMBOPHILIA
D688,OTHER SPECIFIED COAGULATION DEFECTS
D6951,POSTTRANSFUSION PURPURA
D6959,OTHER SECONDARY THROMBOCYTOPENIA
D702,OTHER DRUG-INDUCED AGRANULOCYTOSIS
D7282,ELEVATED WHITE BLOOD CELL COUNT
D750,FAMILIAL ERYTHROCYTOSIS
D759,"DISEASE OF BLOOD AND BLOOD-FORMING ORGANS, UNSPECIFIED"
D805,IMMUNODEFICIENCY WITH INCREASED IMMUNOGLOBULIN M [IGM]
D839,"COMMON VARIABLE IMMUNODEFICIENCY, UNSPECIFIED"
D849,"IMMUNODEFICIENCY, UNSPECIFIED"
D861,SARCOIDOSIS OF LYMPH NODES
D8685,SARCOID MYOCARDITIS
D8689,SARCOIDOSIS OF OTHER SITES
D8940,"MAST CELL ACTIVATION, UNSPECIFIED"
E011,IODINE-DEFICIENCY RELATED MULTINODULAR (ENDEMIC) GOITER
E032,HYPOTHYROIDISM DUE TO MEDS AND OTH EXOGENOUS SUBSTANCES
E034,ATROPHY OF THYROID (ACQUIRED)
E042,NONTOXIC MULTINODULAR GOITER
E0590,"THYROTOXICOSIS, UNSP WITHOUT THYROTOXIC CRISIS OR STORM"
E069,"THYROIDITIS, UNSPECIFIED"
E0833,DIABETES DUE TO UNDRL COND W MODERATE NONPRLF DIABETIC RTNOP
E0869,DIABETES DUE TO UNDERLYING CONDITION W OTH COMPLICATION
E089,DIABETES DUE TO UNDERLYING CONDITION W/O COMPLICATIONS
E0940,"DRUG/CHEM DIABETES W NEURO COMP W DIABETIC NEUROPATHY, UNSP"
E1034,TYPE 1 DIABETES W SEVERE NONPRLF DIABETIC RETINOPATHY
E1069,TYPE 1 DIABETES MELLITUS WITH OTHER SPECIFIED COMPLICATION
E1121,TYPE 2 DIABETES MELLITUS WITH DIABETIC NEPHROPATHY
E1142,TYPE 2 DIABETES MELLITUS WITH DIABETIC POLYNEUROPATHY
E1163,TYPE 2 DIABETES MELLITUS WITH ORAL COMPLICATIONS
E1333,OTH DIABETES W MODERATE NONPRLF DIABETIC RETINOPATHY
E1369,OTH DIABETES MELLITUS WITH OTHER SPECIFIED COMPLICATION
E233,"HYPOTHALAMIC DYSFUNCTION, NOT ELSEWHERE CLASSIFIED"
E2609,OTHER PRIMARY HYPERALDOSTERONISM
E280,ESTROGEN EXCESS
E281,ANDROGEN EXCESS
E661,DRUG-INDUCED OBESITY
E670,HYPERVITAMINOSIS A
E7030,"ALBINISM, UNSPECIFIED"
E705,DISORDERS OF TRYPTOPHAN METABOLISM
E7089,OTHER DISORDERS OF AROMATIC AMINO-ACID METABOLISM
E7200,"DISORDERS OF AMINO-ACID TRANSPORT, UNSPECIFIED"
E728,OTHER SPECIFIED DISORDERS OF AMINO-ACID METABOLISM
E7411,ESSENTIAL FRUCTOSURIA
E7431,SUCRASE-ISOMALTASE DEFICIENCY
E749,"DISORDER OF CARBOHYDRATE METABOLISM, UNSPECIFIED"
E761,"MUCOPOLYSACCHARIDOSIS, TYPE II"
E8419,CYSTIC FIBROSIS WITH OTHER INTESTINAL MANIFESTATIONS
E850,NON-NEUROPATHIC HEREDOFAMILIAL AMYLOIDOSIS
E873,ALKALOSIS
E876,HYPOKALEMIA
E8801,ALPHA-1-ANTITRYPSIN DEFICIENCY
E889,"METABOLIC DISORDER, UNSPECIFIED"
E8981,POSTPROC HEMORRHAGE OF AN ENDO SYS ORG FOLLOWING A PROCEDURE
F0154,"VASCULAR DEMENTIA, UNSPECIFIED SEVERITY, WITH ANXIETY"
F01A0,"VASCULAR DEMENTIA, MILD, WITHOUT BEH/PSYCH/MOOD/ANX"
F01B3,"VASCULAR DEMENTIA, MODERATE, WITH MOOD DISTURBANCE"
F02C1,"DEM IN OTHER DIS CLASSD ELSWHR, SEVERE, WITH BEH DISTURB"
F03A0,"UNSPECIFIED DEMENTIA, MILD, WITHOUT BEH/PSYCH/MOOD/ANX"
F1018,ALCOHOL ABUSE WITH OTHER ALCOHOL-INDUCED DISORDERS
F1123,OPIOID DEPENDENCE WITH WITHDRAWAL
F1193,"OPIOID USE, UNSPECIFIED WITH WITHDRAWAL"
F1292,"CANNABIS USE, UNSPECIFIED WITH INTOXICATION"
F1324,"SEDATIVE, HYPNOTIC OR ANXIOLYTIC DEPENDENCE W MOOD DISORDER"
F1390,"SEDATIVE, HYPNOTIC, OR ANXIOLYTIC USE, UNSP, UNCOMPLICATED"
F1492,"COCAINE USE, UNSPECIFIED WITH INTOXICATION"
F1515,OTH STIMULANT ABUSE W STIMULANT-INDUCED PSYCHOTIC DISORDER
F1611,"HALLUCINOGEN ABUSE, IN REMISSION"
F1921,"OTHER PSYCHOACTIVE SUBSTANCE DEPENDENCE, IN REMISSION"
F259,"SCHIZOAFFECTIVE DISORDER, UNSPECIFIED"
F333,"MAJOR DEPRESSV DISORDER, RECURRENT, SEVERE W PSYCH SYMPTOMS"
F5104,PSYCHOPHYSIOLOGIC INSOMNIA
F606,AVOIDANT PERSONALITY DISORDER
F6381,INTERMITTENT EXPLOSIVE DISORDER
F640,TRANSSEXUALISM
F654,PEDOPHILIA
F6812,"FACTIT DISORD IMPSD ON SELF, WITH PREDOM PHYSCL SIGNS/SYMP"
F8189,OTHER DEVELOPMENTAL DISORDERS OF SCHOLASTIC SKILLS
F911,"CONDUCT DISORDER, CHILDHOOD-ONSET TYPE"
F958,OTHER TIC DISORDERS
G003,STAPHYLOCOCCAL MENINGITIS
G032,BENIGN RECURRENT MENINGITIS [MOLLARET]
G0481,OTHER ENCEPHALITIS AND ENCEPHALOMYELITIS
G060,INTRACRANIAL ABSCESS AND GRANULOMA
G113,CEREBELLAR ATAXIA WITH DEFECTIVE DNA REPAIR
G243,SPASMODIC TORTICOLLIS
G2561,DRUG INDUCED TICS
G311,"SENILE DEGENERATION OF BRAIN, NOT ELSEWHERE CLASSIFIED"
G3181,ALPERS DISEASE
G40B0,"JUVENILE MYOCLONIC EPILEPSY, NOT INTRACTABLE"
G4371,"CHRONIC MIGRAINE WITHOUT AURA, INTRACTABLE"
G4432,CHRONIC POST-TRAUMATIC HEADACHE
G4451,HEMICRANIA CONTINUA
G4486,CERVICOGENIC HEADACHE
G459,"TRANSIENT CEREBRAL ISCHEMIC ATTACK, UNSPECIFIED"
G464,CEREBELLAR STROKE SYNDROME
G467,OTHER LACUNAR SYNDROMES
G4733,OBSTRUCTIVE SLEEP APNEA (ADULT) (PEDIATRIC)
G4734,IDIO SLEEP RELATED NONOBSTRUCTIVE ALVEOLAR HYPOVENTILATION
G4737,CENTRAL SLEEP APNEA IN CONDITIONS CLASSIFIED ELSEWHERE
G4741,NARCOLEPSY
G501,ATYPICAL FACIAL PAIN
G5613,"OTHER LESIONS OF MEDIAN NERVE, BILATERAL UPPER LIMBS"
G5692,UNSPECIFIED MONONEUROPATHY OF LEFT UPPER LIMB
G5703,"LESION OF SCIATIC NERVE, BILATERAL LOWER LIMBS"
G5710,"MERALGIA PARESTHETICA, UNSPECIFIED LOWER LIMB"
G5750,"TARSAL TUNNEL SYNDROME, UNSPECIFIED LOWER LIMB"
G5760,"LESION OF PLANTAR NERVE, UNSPECIFIED LOWER LIMB"
G5763,"LESION OF PLANTAR NERVE, BILATERAL LOWER LIMBS"
G5791,UNSPECIFIED MONONEUROPATHY OF RIGHT LOWER LIMB
G622,POLYNEUROPATHY DUE TO OTHER TOXIC AGENTS
G650,SEQUELAE OF GUILLAIN-BARRE SYNDROME
G710,MUSCULAR DYSTROPHY
G7112,MYOTONIA CONGENITA
G7119,OTHER SPECIFIED MYOTONIC DISORDERS
G7281,CRITICAL ILLNESS MYOPATHY
G8100,FLACCID HEMIPLEGIA AFFECTING UNSPECIFIED SIDE
G830,DIPLEGIA OF UPPER LIMBS
G8312,MONOPLEGIA OF LOWER LIMB AFFECTING LEFT DOMINANT SIDE
G8323,MONOPLEGIA OF UPPER LIMB AFFECTING RIGHT NONDOMINANT SIDE
G8334,"MONOPLEGIA, UNSPECIFIED AFFECTING LEFT NONDOMINANT SIDE"
G904,AUTONOMIC DYSREFLEXIA
G909,"DISORDER OF THE AUTONOMIC NERVOUS SYSTEM, UNSPECIFIED"
G933,POSTVIRAL AND RELATED FATIGUE SYNDROMES
G950,SYRINGOMYELIA AND SYRINGOBULBIA
G9529,OTHER CORD COMPRESSION
G9741,ACCIDENTAL PUNCTURE OR LACERATION OF DURA DURING A PROCEDURE
H0111,ALLERGIC DERMATITIS OF EYELID
H0212,MECHANICAL ECTROPION OF EYELID
H0272,MADAROSIS OF EYELID AND PERIOCULAR AREA
H029,UNSPECIFIED DISORDER OF EYELID
H0412,DRY EYE SYNDROME
H0512,ORBITAL MYOSITIS
H0520,UNSPECIFIED EXOPHTHALMOS
H059,UNSPECIFIED DISORDER OF ORBIT
H1013,"ACUTE ATOPIC CONJUNCTIVITIS, BILATERAL"
H1040,UNSPECIFIED CHRONIC CONJUNCTIVITIS
H1100,UNSPECIFIED PTERYGIUM OF EYE
H1182,CONJUNCTIVOCHALASIS
H1622,"KERATOCONJUNCTIVITIS SICCA, NOT SPECIFIED AS SJOGREN'S"
H169,UNSPECIFIED KERATITIS
H1711,"CENTRAL CORNEAL OPACITY, RIGHT EYE"
H1713,"CENTRAL CORNEAL OPACITY, BILATERAL"
H1849,OTHER CORNEAL DEGENERATION
H1860,"KERATOCONUS, UNSPECIFIED"
H1879,OTHER CORNEAL DEFORMITIES
H189,UNSPECIFIED DISORDER OF CORNEA
H2001,PRIMARY IRIDOCYCLITIS
H2155,RECESSION OF CHAMBER ANGLE
H2520,"AGE-RELATED CATARACT, MORGAGNIAN TYPE, UNSPECIFIED EYE"
H2610,UNSPECIFIED TRAUMATIC CATARACT
H2622,CATARACT SECONDARY TO OCULAR DISORDERS (INFLAMMATORY)
H3411,"CENTRAL RETINAL ARTERY OCCLUSION, RIGHT EYE"
H3520,"OTHER NON-DIABETIC PROLIFERATIVE RETINOPATHY, UNSP EYE"
H3534,"MACULAR CYST, HOLE, OR PSEUDOHOLE"
H3540,UNSPECIFIED PERIPHERAL RETINAL DEGENERATION
H3543,PAVING STONE DEGENERATION OF RETINA
H3571,CENTRAL SEROUS CHORIORETINOPATHY
H3582,RETINAL ISCHEMIA
H4022,CHRONIC ANGLE-CLOSURE GLAUCOMA
H4060,"GLAUCOMA SECONDARY TO DRUGS, UNSPECIFIED EYE"
H4062,"GLAUCOMA SECONDARY TO DRUGS, LEFT EYE"
H4303,"VITREOUS PROLAPSE, BILATERAL"
H4419,OTHER ENDOPHTHALMITIS
H4443,HYPOTONY OF EYE DUE TO OTHER OCULAR DISORDERS
H4701,ISCHEMIC OPTIC NEUROPATHY
H4723,GLAUCOMATOUS OPTIC ATROPHY
H4733,PSEUDOPAPILLEDEMA OF OPTIC DISC
H4742,DISORDERS OF OPTIC CHIASM IN (DUE TO) NEOPLASM
H4910,"FOURTH [TROCHLEAR] NERVE PALSY, UNSPECIFIED EYE"
H5033,INTERMITTENT MONOCULAR EXOTROPIA
H5069,OTHER MECHANICAL STRABISMUS
H5081,DUANE'S SYNDROME
H5340,UNSPECIFIED VISUAL FIELD DEFECTS
H5341,SCOTOMA INVOLVING CENTRAL AREA
H5361,ABNORMAL DARK ADAPTATION CURVE
H5371,GLARE SENSITIVITY
H5711,"OCULAR PAIN, RIGHT EYE"
H5940,"INFLAMMATION (INFECTION) OF POSTPROCEDURAL BLEB, UNSPECIFIED"
H6000,"ABSCESS OF EXTERNAL EAR, UNSPECIFIED EAR"
H6001,ABSCESS OF RIGHT EXTERNAL EAR
H6011,CELLULITIS OF RIGHT EXTERNAL EAR
H6060,"UNSPECIFIED CHRONIC OTITIS EXTERNA, UNSPECIFIED EAR"
H6090,"UNSPECIFIED OTITIS EXTERNA, UNSPECIFIED EAR"
H6123,"IMPACTED CERUMEN, BILATERAL"
H6190,"DISORDER OF EXTERNAL EAR, UNSPECIFIED, UNSPECIFIED EAR"
H6241,"OTITIS EXTERNA IN OTH DISEASES CLASSD ELSWHR, RIGHT EAR"
H6504,"ACUTE SEROUS OTITIS MEDIA, RECURRENT, RIGHT EAR"
H6549,OTHER CHRONIC NONSUPPURATIVE OTITIS MEDIA
H6611,"CHRONIC TUBOTYMPANIC SUPPURATIVE OTITIS MEDIA, RIGHT EAR"
H6692,"OTITIS MEDIA, UNSPECIFIED, LEFT EAR"
H671,"OTITIS MEDIA IN DISEASES CLASSIFIED ELSEWHERE, RIGHT EAR"
H672,"OTITIS MEDIA IN DISEASES CLASSIFIED ELSEWHERE, LEFT EAR"
H6992,"UNSPECIFIED EUSTACHIAN TUBE DISORDER, LEFT EAR"
H7011,"CHRONIC MASTOIDITIS, RIGHT EAR"
H7122,"CHOLESTEATOMA OF MASTOID, LEFT EAR"
H7190,"UNSPECIFIED CHOLESTEATOMA, UNSPECIFIED EAR"
H7491,UNSPECIFIED DISORDER OF RIGHT MIDDLE EAR AND MASTOID
H8103,"MENIERE'S DISEASE, BILATERAL"
H8122,"VESTIBULAR NEURONITIS, LEFT EAR"
H8149,null
H9190,"UNSPECIFIED HEARING LOSS, UNSPECIFIED EAR"
H9191,"UNSPECIFIED HEARING LOSS, RIGHT EAR"
H9211,"OTORRHEA, RIGHT EAR"
H9221,"OTORRHAGIA, RIGHT EAR"
H9329,OTHER ABNORMAL AUDITORY PERCEPTIONS
H938X,OTHER SPECIFIED DISORDERS OF EAR
I080,RHEUMATIC DISORDERS OF BOTH MITRAL AND AORTIC VALVES
I081,RHEUMATIC DISORDERS OF BOTH MITRAL AND TRICUSPID VALVES
I130,HYP HRT & CHR KDNY DIS W HRT FAIL AND STG 1-4/UNSP CHR KDNY
I132,HYP HRT & CHR KDNY DIS W HRT FAIL AND W STG 5 CHR KDNY/ESRD
I2581,ATHEROSCLEROSIS OF OTH CORONARY VESSELS W/O ANGINA PECTORIS
I2690,SEPTIC PULMONARY EMBOLISM WITHOUT ACUTE COR PULMONALE
I2729,OTHER SECONDARY PULMONARY HYPERTENSION
I330,ACUTE AND SUBACUTE INFECTIVE ENDOCARDITIS
I3489,OTHER NONRHEUMATIC MITRAL VALVE DISORDERS
I351,NONRHEUMATIC AORTIC (VALVE) INSUFFICIENCY
I378,OTHER NONRHEUMATIC PULMONARY VALVE DISORDERS
I400,INFECTIVE MYOCARDITIS
I401,ISOLATED MYOCARDITIS
I427,CARDIOMYOPATHY DUE TO DRUG AND EXTERNAL AGENT
I5020,UNSPECIFIED SYSTOLIC (CONGESTIVE) HEART FAILURE
I509,"HEART FAILURE, UNSPECIFIED"
I517,CARDIOMEGALY
I52,OTHER HEART DISORDERS IN DISEASES CLASSIFIED ELSEWHERE
I602,NTRM SUBARACH HEMORRHAGE FROM ANTERIOR COMMUNICATING ARTERY
I606,NONTRAUMATIC SUBARACHNOID HEMORRHAGE FROM OTH INTRACRAN ART
I612,"NONTRAUMATIC INTRACEREBRAL HEMORRHAGE IN HEMISPHERE, UNSP"
I6329,CEREBRAL INFRC DUE TO UNSP OCCLS OR STENOSIS OF PRECERB ART
I6353,CEREB INFRC DUE TO UNSP OCCLS OR STENOS OF POST CEREB ARTERY
I6389,OTHER CEREBRAL INFARCTION
I6503,OCCLUSION AND STENOSIS OF BILATERAL VERTEBRAL ARTERIES
I6603,OCCLUSION AND STENOSIS OF BILATERAL MIDDLE CEREBRAL ARTERIES
I6613,OCCLUSION AND STENOSIS OF BI ANTERIOR CEREBRAL ARTERIES
I668,OCCLUSION AND STENOSIS OF OTHER CEREBRAL ARTERIES
I669,OCCLUSION AND STENOSIS OF UNSPECIFIED CEREBRAL ARTERY
I6785,HEREDITARY CEREBROVASCULAR DISEASES
I7021,ATHSCL NATIVE ARTERIES OF EXTREMITIES W INTERMITTENT CLAUD
I7025,ATHSCL NATIVE ARTERIES OF EXTREMITIES W ULCERATION
I7100,DISSECTION OF UNSPECIFIED SITE OF AORTA
I7110,"THORACIC AORTIC ANEURYSM, RUPTURED, UNSPECIFIED"
I7123,"ANEURYSM OF THE DESCENDING THORACIC AORTA, WITHOUT RUPTURE"
I714,"ABDOMINAL AORTIC ANEURYSM, WITHOUT RUPTURE"
I7140,"ABDOMINAL AORTIC ANEURYSM, WITHOUT RUPTURE, UNSPECIFIED"
I728,ANEURYSM OF OTHER SPECIFIED ARTERIES
I742,EMBOLISM AND THROMBOSIS OF ARTERIES OF THE UPPER EXTREMITIES
I7772,DISSECTION OF ILIAC ARTERY
I8003,"PHLBTS AND THOMBOPHLB OF SUPERFIC VESSELS OF LOW EXTRM, BI"
I8249,ACUTE EMBOLISM AND THROMBOSIS OF DEEP VEIN OF LOW EXTRM
I8391,ASYMPTOMATIC VARICOSE VEINS OF RIGHT LOWER EXTREMITY
J0121,ACUTE RECURRENT ETHMOIDAL SINUSITIS
J0391,"ACUTE RECURRENT TONSILLITIS, UNSPECIFIED"
J1000,FLU DUE TO OTH IDENT FLU VIRUS W UNSP TYPE OF PNEUMONIA
J1008,INFLUENZA DUE TO OTH IDENT INFLUENZA VIRUS W OTH PNEUMONIA
J1183,INFLUENZA DUE TO UNIDENTIFIED INFLUENZA VIRUS W OTITIS MEDIA
J13,PNEUMONIA DUE TO STREPTOCOCCUS PNEUMONIAE
J1529,PNEUMONIA DUE TO OTHER STAPHYLOCOCCUS
J343,HYPERTROPHY OF NASAL TURBINATES
J352,HYPERTROPHY OF ADENOIDS
J3802,"PARALYSIS OF VOCAL CORDS AND LARYNX, BILATERAL"
J398,OTHER SPECIFIED DISEASES OF UPPER RESPIRATORY TRACT
J418,MIXED SIMPLE AND MUCOPURULENT CHRONIC BRONCHITIS
J432,CENTRILOBULAR EMPHYSEMA
J4522,MILD INTERMITTENT ASTHMA WITH STATUS ASTHMATICUS
J4530,"MILD PERSISTENT ASTHMA, UNCOMPLICATED"
J4540,"MODERATE PERSISTENT ASTHMA, UNCOMPLICATED"
J4542,MODERATE PERSISTENT ASTHMA WITH STATUS ASTHMATICUS
J668,AIRWAY DISEASE DUE TO OTHER SPECIFIC ORGANIC DUSTS
J8410,"PULMONARY FIBROSIS, UNSPECIFIED"
J940,CHYLOUS EFFUSION
J941,FIBROTHORAX
J949,"PLEURAL CONDITION, UNSPECIFIED"
J9585,COMPLICATION OF RESPIRATOR [VENTILATOR]
J9620,"ACUTE AND CHR RESP FAILURE, UNSP W HYPOXIA OR HYPERCAPNIA"
K0401,REVERSIBLE PULPITIS
K0501,"ACUTE GINGIVITIS, NON-PLAQUE INDUCED"
K0843,PARTIAL LOSS OF TEETH DUE TO CARIES
K0849,PARTIAL LOSS OF TEETH DUE TO OTHER SPECIFIED CAUSE
K115,SIALOLITHIASIS
K1231,ORAL MUCOSITIS (ULCERATIVE) DUE TO ANTINEOPLASTIC THERAPY
K133,HAIRY LEUKOPLAKIA
K200,EOSINOPHILIC ESOPHAGITIS
K209,"ESOPHAGITIS, UNSPECIFIED"
K251,ACUTE GASTRIC ULCER WITH PERFORATION
K256,CHRONIC OR UNSP GASTRIC ULCER W BOTH HEMORRHAGE AND PERF
K264,CHRONIC OR UNSPECIFIED DUODENAL ULCER WITH HEMORRHAGE
K267,CHRONIC DUODENAL ULCER WITHOUT HEMORRHAGE OR PERFORATION
K317,POLYP OF STOMACH AND DUODENUM
K3530,"ACUTE APPENDICITIS WITH LOC PERITONITIS, W/O PERF OR GANGR"
K37,UNSPECIFIED APPENDICITIS
K4020,"BI INGUINAL HERNIA, W/O OBST OR GANGRENE, NOT SPCF AS RECUR"
K4191,"UNILATERAL FEMORAL HERNIA, W/O OBST OR GANGRENE, RECURRENT"
K461,UNSPECIFIED ABDOMINAL HERNIA WITH GANGRENE
K5010,CROHN'S DISEASE OF LARGE INTESTINE WITHOUT COMPLICATIONS
K5120,ULCERATIVE (CHRONIC) PROCTITIS WITHOUT COMPLICATIONS
K5191,"ULCERATIVE COLITIS, UNSPECIFIED, WITH COMPLICATIONS"
K520,GASTROENTERITIS AND COLITIS DUE TO RADIATION
K5732,DVTRCLI OF LG INT W/O PERFORATION OR ABSCESS W/O BLEEDING
K5740,DVTRCLI OF BOTH SMALL AND LG INT W PERF AND ABSCS W/O BLEED
K5781,"DVTRCLI OF INTEST, PART UNSP, W PERF AND ABSCESS W BLEEDING"
K5791,"DVRTCLOS OF INTEST, PART UNSP, W/O PERF OR ABSCESS W BLEED"
K588,OTHER IRRITABLE BOWEL SYNDROME
K5900,"CONSTIPATION, UNSPECIFIED"
K5981,OGILVIE SYNDROME
K5989,OTHER SPECIFIED FUNCTIONAL INTESTINAL DISORDERS
K612,ANORECTAL ABSCESS
K614,INTRASPHINCTERIC ABSCESS
K6281,ANAL SPHINCTER TEAR (HEALED) (NONTRAUMATIC) (OLD)
K702,ALCOHOLIC FIBROSIS AND SCLEROSIS OF LIVER
K731,"CHRONIC LOBULAR HEPATITIS, NOT ELSEWHERE CLASSIFIED"
K7589,OTHER SPECIFIED INFLAMMATORY LIVER DISEASES
K766,PORTAL HYPERTENSION
K769,"LIVER DISEASE, UNSPECIFIED"
K8021,CALCULUS OF GALLBLADDER W/O CHOLECYSTITIS WITH OBSTRUCTION
K8036,CALCULUS OF BILE DUCT W ACUTE AND CHR CHOLANGITIS W/O OBST
K8060,"CALCULUS OF GB AND BILE DUCT W CHOLECYST, UNSP, W/O OBST"
K820,OBSTRUCTION OF GALLBLADDER
K912,"POSTSURGICAL MALABSORPTION, NOT ELSEWHERE CLASSIFIED"
K9130,"POSTPROC INTESTINAL OBST, UNSP AS TO PARTIAL VERSUS COMPLETE"
K9401,COLOSTOMY HEMORRHAGE
K9402,COLOSTOMY INFECTION
K9420,"GASTROSTOMY COMPLICATION, UNSPECIFIED"
L0102,BOCKHART'S IMPETIGO
L0222,FURUNCLE OF TRUNK
L0242,FURUNCLE OF LIMB
L0251,CUTANEOUS ABSCESS OF HAND
L041,ACUTE LYMPHADENITIS OF TRUNK
L110,ACQUIRED KERATOSIS FOLLICULARIS
L111,TRANSIENT ACANTHOLYTIC DERMATOSIS [GROVER]
L130,DERMATITIS HERPETIFORMIS
L2082,FLEXURAL ECZEMA
L232,ALLERGIC CONTACT DERMATITIS DUE TO COSMETICS
L239,"ALLERGIC CONTACT DERMATITIS, UNSPECIFIED CAUSE"
L242,IRRITANT CONTACT DERMATITIS DUE TO SOLVENTS
L243,IRRITANT CONTACT DERMATITIS DUE TO COSMETICS
L279,DERMATITIS DUE TO UNSPECIFIED SUBSTANCE TAKEN INTERNALLY
L304,ERYTHEMA INTERTRIGO
L4050,"ARTHROPATHIC PSORIASIS, UNSPECIFIED"
L438,OTHER LICHEN PLANUS
L448,OTHER SPECIFIED PAPULOSQUAMOUS DISORDERS
L506,CONTACT URTICARIA
L559,"SUNBURN, UNSPECIFIED"
L565,DISSEMINATED SUPERFICIAL ACTINIC POROKERATOSIS (DSAP)
L603,NAIL DYSTROPHY
L669,"CICATRICIAL ALOPECIA, UNSPECIFIED"
L718,OTHER ROSACEA
L740,MILIARIA RUBRA
L750,BROMHIDROSIS
L759,"APOCRINE SWEAT DISORDER, UNSPECIFIED"
L7621,"POSTPROC HEMOR OF SKIN, SUBCU FOL A DERMATOLOGIC PROCEDURE"
L7633,"POSTPROC SEROMA OF SKIN, SUBCU FOL A DERMATOLOGIC PROCEDURE"
L817,PIGMENTED PURPURIC DERMATOSIS
L821,OTHER SEBORRHEIC KERATOSIS
L852,KERATOSIS PUNCTATA (PALMARIS ET PLANTARIS)
L870,KERATOS FOLLICULARIS ET PARAFOLLICULARIS IN CUTEM PENETRANS
L8910,PRESSURE ULCER OF UNSPECIFIED PART OF BACK
L8920,PRESSURE ULCER OF UNSPECIFIED HIP
L8921,PRESSURE ULCER OF RIGHT HIP
L8922,PRESSURE ULCER OF LEFT HIP
L906,STRIAE ATROPHICAE
L950,LIVEDOID VASCULITIS
L9841,NON-PRESSURE CHRONIC ULCER OF BUTTOCK
L9842,NON-PRESSURE CHRONIC ULCER OF BACK
L988,OTH DISRD OF THE SKIN AND SUBCUTANEOUS TISSUE
M0007,"STAPHYLOCOCCAL ARTHRITIS, ANKLE AND FOOT"
M0081,"ARTHRITIS DUE TO OTHER BACTERIA, SHOULDER"
M0084,"ARTHRITIS DUE TO OTHER BACTERIA, HAND"
M0520,RHEUMATOID VASCULITIS WITH RHEUMATOID ARTHRITIS OF UNSP SITE
M0544,RHEUMATOID MYOPATHY WITH RHEUMATOID ARTHRITIS OF HAND
M0605,"RHEUMATOID ARTHRITIS WITHOUT RHEUMATOID FACTOR, HIP"
M0686,"OTHER SPECIFIED RHEUMATOID ARTHRITIS, KNEE"
M0800,UNSP JUVENILE RHEUMATOID ARTHRITIS OF UNSPECIFIED SITE
M0886,"OTHER JUVENILE ARTHRITIS, KNEE"
M1036,"GOUT DUE TO RENAL IMPAIRMENT, KNEE"
M1200,"CHRONIC POSTRHEUMATIC ARTHROPATHY, UNSPECIFIED SITE"
M1251,"TRAUMATIC ARTHROPATHY, SHOULDER"
M1280,"OTH SPECIFIC ARTHROPATHIES, NEC, UNSP SITE"
M130,"POLYARTHRITIS, UNSPECIFIED"
M1314,"MONOARTHRITIS, NOT ELSEWHERE CLASSIFIED, HAND"
M1630,"UNILATERAL OSTEOARTH RESULTING FROM HIP DYSPLASIA, UNSP HIP"
M1921,"SECONDARY OSTEOARTHRITIS, SHOULDER"
M1991,"PRIMARY OSTEOARTHRITIS, UNSPECIFIED SITE"
M1A07,"IDIOPATHIC CHRONIC GOUT, ANKLE AND FOOT"
M1A37,"CHRONIC GOUT DUE TO RENAL IMPAIRMENT, ANKLE AND FOOT"
M2107,"VALGUS DEFORMITY, NOT ELSEWHERE CLASSIFIED, ANKLE"
M2117,"VARUS DEFORMITY, NOT ELSEWHERE CLASSIFIED, ANKLE"
M2141,"FLAT FOOT [PES PLANUS] (ACQUIRED), RIGHT FOOT"
M2170,"UNEQUAL LIMB LENGTH (ACQUIRED), UNSPECIFIED SITE"
M2330,"OTHER MENISCUS DERANGEMENTS, UNSPECIFIED MENISCUS"
M2362,OTH SPON DISRUPTION OF POSTERIOR CRUCIATE LIGAMENT OF KNEE
M2391,UNSPECIFIED INTERNAL DERANGEMENT OF RIGHT KNEE
M2408,"LOOSE BODY, OTHER SITE"
M2412,"OTHER ARTICULAR CARTILAGE DISORDERS, ELBOW"
M2462,"ANKYLOSIS, ELBOW"
M2552,PAIN IN ELBOW
M2559,PAIN IN OTHER SPECIFIED JOINT
M2603,MANDIBULAR HYPERPLASIA
M2619,OTHER SPECIFIED ANOMALIES OF JAW-CRANIAL BASE RELATIONSHIP
M2620,UNSPECIFIED ANOMALY OF DENTAL ARCH RELATIONSHIP
M2650,"DENTOFACIAL FUNCTIONAL ABNORMALITIES, UNSPECIFIED"
M2682,POSTERIOR SOFT TISSUE IMPINGEMENT
M2740,UNSPECIFIED CYST OF JAW
M3212,PERICARDITIS IN SYSTEMIC LUPUS ERYTHEMATOSUS
M329,"SYSTEMIC LUPUS ERYTHEMATOSUS, UNSPECIFIED"
M3489,OTHER SYSTEMIC SCLEROSIS
M4045,"POSTURAL LORDOSIS, THORACOLUMBAR REGION"
M4111,JUVENILE IDIOPATHIC SCOLIOSIS
M4125,"OTHER IDIOPATHIC SCOLIOSIS, THORACOLUMBAR REGION"
M4134,"THORACOGENIC SCOLIOSIS, THORACIC REGION"
M4153,"OTHER SECONDARY SCOLIOSIS, CERVICOTHORACIC REGION"
M4180,"OTHER FORMS OF SCOLIOSIS, SITE UNSPECIFIED"
M4306,"SPONDYLOLYSIS, LUMBAR REGION"
M4307,"SPONDYLOLYSIS, LUMBOSACRAL REGION"
M4308,"SPONDYLOLYSIS, SACRAL AND SACROCOCCYGEAL REGION"
M434,OTHER RECURRENT ATLANTOAXIAL DISLOCATION
M450,ANKYLOSING SPONDYLITIS OF MULTIPLE SITES IN SPINE
M45A7,NON-RADIOGRAPHIC AXIAL SPONDYLOARTHRITIS OF LUMBOSACR REGION
M45AB,NON-RADIOGRAPHIC AXIAL SPONDYLOARTHRITIS MULT SITE IN SPINE
M461,"SACROILIITIS, NOT ELSEWHERE CLASSIFIED"
M4626,"OSTEOMYELITIS OF VERTEBRA, LUMBAR REGION"
M4638,"INFECTION OF INTVRT DISC (PYOGENIC), SACR/SACROCYGL REGION"
M4689,"OTH INFLAMMATORY SPONDYLOPATHIES, MULTIPLE SITES IN SPINE"
M4701,ANTERIOR SPINAL ARTERY COMPRESSION SYNDROMES
M4781,SPONDYLOSIS WITHOUT MYELOPATHY OR RADICULOPATHY
M4806,"SPINAL STENOSIS, LUMBAR REGION"
M4854,"COLLAPSED VERTEBRA, NEC, THORACIC REGION"
M4986,"SPONDYLOPATHY IN DISEASES CLASSD ELSWHR, LUMBAR REGION"
M5081,"OTHER CERVICAL DISC DISORDERS, HIGH CERVICAL REGION"
M5092,"CERVICAL DISC DISORDER, UNSPECIFIED, MID-CERVICAL REGION"
M5116,"INTERVERTEBRAL DISC DISORDERS W RADICULOPATHY, LUMBAR REGION"
M5387,"OTHER SPECIFIED DORSOPATHIES, LUMBOSACRAL REGION"
M5406,"PANNICULITIS AFFECTING REGIONS OF NECK/BK, LUMBAR REGION"
