CODE,DESCRIPTION
Z3685,ENCOUNTER FOR ANTENATAL SCREENING FOR STREPTOCOCCUS B
Z3688,ENCOUNTER FOR ANTENATAL SCREENING FOR FETAL MACROSOMIA
Z3A32,32 WEEKS GESTATION OF PREGNANCY
Z3A41,41 WEEKS GESTATION OF PREGNANCY
Z419,"ENCNTR FOR PROC FOR PURPOSE OTH THAN REMEDY HLTH STATE, UNSP"
Z4501,ENCOUNTER FOR ADJUSTMENT AND MANAGEMENT OF CARDIAC PACEMAKER
Z4659,ENCOUNTER FOR FIT/ADJST OF GI APPLIANCE AND DEVICE
Z469,ENCOUNTER FOR FITTING AND ADJUSTMENT OF UNSPECIFIED DEVICE
Z4803,ENCOUNTER FOR CHANGE OR REMOVAL OF DRAINS
Z4931,ENCOUNTER FOR ADEQUACY TESTING FOR HEMODIALYSIS
Z5339,OTHER SPECIFIED PROCEDURE CONVERTED TO OPEN PROCEDURE
Z538,PROCEDURE AND TREATMENT NOT CARRIED OUT FOR OTHER REASONS
Z566,OTHER PHYSICAL AND MENTAL STRAIN RELATED TO WORK
Z570,OCCUPATIONAL EXPOSURE TO NOISE
Z574,OCCUPATIONAL EXPOSURE TO TOXIC AGENTS IN AGRICULTURE
Z5989,OTHER PROBLEMS RELATED TO HOUSING AND ECONOMIC CIRCUMSTANCES
Z6281,PERSONAL HISTORY OF ABUSE IN CHILDHOOD
Z636,DEPENDENT RELATIVE NEEDING CARE AT HOME
Z6710,"TYPE A BLOOD, RH POSITIVE"
Z6741,"TYPE O BLOOD, RH NEGATIVE"
Z681,"BODY MASS INDEX [BMI] 19.9 OR LESS, ADULT"
Z6821,"BODY MASS INDEX [BMI] 21.0-21.9, ADULT"
Z6837,"BODY MASS INDEX [BMI] 37.0-37.9, ADULT"
Z733,"STRESS, NOT ELSEWHERE CLASSIFIED"
Z742,NEED FOR ASSIST AT HOME & NO HOUSE MEMB ABLE TO RENDER CARE
Z749,"PROBLEM RELATED TO CARE PROVIDER DEPENDENCY, UNSPECIFIED"
Z751,PERSON AWAITING ADMISSION TO ADEQUATE FACILITY ELSEWHERE
Z7701,CONTACT WITH AND (SUSPECTED) EXPOSURE TO HAZARDOUS METALS
Z7729,CONTACT WITH AND EXPOSURE TO OTHER HAZARDOUS SUBSTANCES
Z789,OTHER SPECIFIED HEALTH STATUS
Z7902,LONG TERM (CURRENT) USE OF ANTITHROMBOTICS/ANTIPLATELETS
Z7951,LONG TERM (CURRENT) USE OF INHALED STEROIDS
Z801,"FAMILY HISTORY OF MALIG NEOPLASM OF TRACHEA, BRONC AND LUNG"
Z8041,FAMILY HISTORY OF MALIGNANT NEOPLASM OF OVARY
Z8052,FAMILY HISTORY OF MALIGNANT NEOPLASM OF BLADDER
Z810,FAMILY HISTORY OF INTELLECTUAL DISABILITIES
Z814,FAMILY HISTORY OF OTHER SUBSTANCE ABUSE AND DEPENDENCE
Z8507,PERSONAL HISTORY OF MALIGNANT NEOPLASM OF PANCREAS
Z8522,"PRSNL HX OF MALIG NEOPLM OF NASL CAV, MID EAR, & ACCES SINUS"
Z8540,PRSNL HISTORY OF MALIG NEOPLM OF UNSP FEMALE GENITAL ORGAN
Z8542,PERSONAL HISTORY OF MALIGNANT NEOPLASM OF OTH PRT UTERUS
Z8603,PERSONAL HISTORY OF NEOPLASM OF UNCERTAIN BEHAVIOR
Z8672,PERSONAL HISTORY OF THROMBOPHLEBITIS
Z8782,PERSONAL HISTORY OF OTH (HEALED) PHYSICAL INJURY AND TRAUMA
Z8901,ACQUIRED ABSENCE OF THUMB
Z8941,ACQUIRED ABSENCE OF GREAT TOE
Z8951,ACQUIRED ABSENCE OF LEG BELOW KNEE
Z8952,ACQUIRED ABSENCE OF KNEE
Z9009,ACQUIRED ABSENCE OF OTHER PART OF HEAD AND NECK
Z9013,ACQUIRED ABSENCE OF BILATERAL BREASTS AND NIPPLES
Z902,ACQUIRED ABSENCE OF LUNG [PART OF]
Z906,ACQUIRED ABSENCE OF OTHER PARTS OF URINARY TRACT
Z9221,PERSONAL HISTORY OF ANTINEOPLASTIC CHEMOTHERAPY
Z9224,PERSONAL HISTORY OF STEROID THERAPY
Z9225,PERSONAL HISTORY OF IMMUNOSUPPRESSION THERAPY
Z932,ILEOSTOMY STATUS
Z945,SKIN TRANSPLANT STATUS
Z951,PRESENCE OF AORTOCORONARY BYPASS GRAFT
Z955,PRESENCE OF CORONARY ANGIOPLASTY IMPLANT AND GRAFT
Z9663,PRESENCE OF ARTIFICIAL WRIST JOINT
Z9666,PRESENCE OF ARTIFICIAL ANKLE JOINT
Z9682,PRESENCE OF NEUROSTIMULATOR
Z969,"PRESENCE OF FUNCTIONAL IMPLANT, UNSPECIFIED"
Z980,INTESTINAL BYPASS AND ANASTOMOSIS STATUS
Z981,ARTHRODESIS STATUS
Z9851,TUBAL LIGATION STATUS
Z9852,VASECTOMY STATUS
S9131,LACERATION WITHOUT FOREIGN BODY OF FOOT
A0104,TYPHOID ARTHRITIS
A039,"SHIGELLOSIS, UNSPECIFIED"
A040,ENTEROPATHOGENIC ESCHERICHIA COLI INFECTION
A069,"AMEBIASIS, UNSPECIFIED"
A0839,OTHER VIRAL ENTERITIS
A157,PRIMARY RESPIRATORY TUBERCULOSIS
A388,SCARLET FEVER WITH OTHER COMPLICATIONS
A400,"SEPSIS DUE TO STREPTOCOCCUS, GROUP A"
A414,SEPSIS DUE TO ANAEROBES
A449,"BARTONELLOSIS, UNSPECIFIED"
A499,"BACTERIAL INFECTION, UNSPECIFIED"
A510,PRIMARY GENITAL SYPHILIS
A515,"EARLY SYPHILIS, LATENT"
A5211,TABES DORSALIS
A5215,LATE SYPHILITIC NEUROPATHY
A549,"GONOCOCCAL INFECTION, UNSPECIFIED"
A568,SEXUALLY TRANSMITTED CHLAMYDIAL INFECTION OF OTHER SITES
A6000,"HERPESVIRAL INFECTION OF UROGENITAL SYSTEM, UNSPECIFIED"
A689,"RELAPSING FEVER, UNSPECIFIED"
A86,UNSPECIFIED VIRAL ENCEPHALITIS
A9230,"WEST NILE VIRUS INFECTION, UNSPECIFIED"
B0050,"HERPESVIRAL OCULAR DISEASE, UNSPECIFIED"
B020,ZOSTER ENCEPHALITIS
B0229,OTHER POSTHERPETIC NERVOUS SYSTEM INVOLVEMENT
B059,MEASLES WITHOUT COMPLICATION
B079,"VIRAL WART, UNSPECIFIED"
B169,ACUTE HEPATITIS B W/O DELTA-AGENT AND WITHOUT HEPATIC COMA
B180,CHRONIC VIRAL HEPATITIS B WITH DELTA-AGENT
B189,"CHRONIC VIRAL HEPATITIS, UNSPECIFIED"
B303,ACUTE EPIDEMIC HEMORRHAGIC CONJUNCTIVITIS (ENTEROVIRAL)
B308,OTHER VIRAL CONJUNCTIVITIS
B341,"ENTEROVIRUS INFECTION, UNSPECIFIED"
B349,"VIRAL INFECTION, UNSPECIFIED"
B3784,CANDIDAL OTITIS EXTERNA
B440,INVASIVE PULMONARY ASPERGILLOSIS
B589,"TOXOPLASMOSIS, UNSPECIFIED"
B6000,"BABESIOSIS, UNSPECIFIED"
B689,"TAENIASIS, UNSPECIFIED"
B781,CUTANEOUS STRONGYLOIDIASIS
B789,"STRONGYLOIDIASIS, UNSPECIFIED"
B829,"INTESTINAL PARASITISM, UNSPECIFIED"
B853,PHTHIRIASIS
B86,SCABIES
B89,UNSPECIFIED PARASITIC DISEASE
B909,SEQUELAE OF RESPIRATORY AND UNSPECIFIED TUBERCULOSIS
B960,MYCOPLASMA PNEUMONIAE AS THE CAUSE OF DISEASES CLASSD ELSWHR
B963,HEMOPHILUS INFLUENZAE AS THE CAUSE OF DISEASES CLASSD ELSWHR
B9735,HIV 2 AS THE CAUSE OF DISEASES CLASSIFIED ELSEWHERE
C023,"MALIG NEOPLASM OF ANTERIOR TWO-THIRDS OF TONGUE, PART UNSP"
C030,MALIGNANT NEOPLASM OF UPPER GUM
C119,"MALIGNANT NEOPLASM OF NASOPHARYNX, UNSPECIFIED"
C155,MALIGNANT NEOPLASM OF LOWER THIRD OF ESOPHAGUS
C185,MALIGNANT NEOPLASM OF SPLENIC FLEXURE
C221,INTRAHEPATIC BILE DUCT CARCINOMA
C251,MALIGNANT NEOPLASM OF BODY OF PANCREAS
C37,MALIGNANT NEOPLASM OF THYMUS
C4022,MALIGNANT NEOPLASM OF LONG BONES OF LEFT LOWER LIMB
C4352,MALIGNANT MELANOMA OF SKIN OF BREAST
C4360,"MALIGNANT MELANOMA OF UNSP UPPER LIMB, INCLUDING SHOULDER"
C4361,"MALIGNANT MELANOMA OF RIGHT UPPER LIMB, INCLUDING SHOULDER"
C4439,OTH MALIGNANT NEOPLASM OF SKIN OF OTH AND UNSP PARTS OF FACE
C4449,OTHER SPECIFIED MALIGNANT NEOPLASM OF SKIN OF SCALP AND NECK
C4450,UNSPECIFIED MALIGNANT NEOPLASM OF SKIN OF TRUNK
C4471,"BASAL CELL CARCINOMA OF SKIN OF LOWER LIMB, INCLUDING HIP"
C479,"MALIG NEOPLASM OF PRPH NERVES AND AUTONM NERVOUS SYS, UNSP"
C493,MALIGNANT NEOPLASM OF CONNECTIVE AND SOFT TISSUE OF THORAX
C4A39,MERKEL CELL CARCINOMA OF OTHER PARTS OF FACE
C562,MALIGNANT NEOPLASM OF LEFT OVARY
C6290,"MALIG NEOPLASM OF UNSP TESTIS, UNSP DESCENDED OR UNDESCENDED"
C670,MALIGNANT NEOPLASM OF TRIGONE OF BLADDER
C688,MALIGNANT NEOPLASM OF OVERLAPPING SITES OF URINARY ORGANS
C6932,MALIGNANT NEOPLASM OF LEFT CHOROID
C717,MALIGNANT NEOPLASM OF BRAIN STEM
C771,SECONDARY AND UNSP MALIGNANT NEOPLASM OF INTRATHORAC NODES
C781,SECONDARY MALIGNANT NEOPLASM OF MEDIASTINUM
C784,SECONDARY MALIGNANT NEOPLASM OF SMALL INTESTINE
C7989,SECONDARY MALIGNANT NEOPLASM OF OTHER SPECIFIED SITES
C799,SECONDARY MALIGNANT NEOPLASM OF UNSPECIFIED SITE
C7B1,SECONDARY MERKEL CELL CARCINOMA
C8209,"FOLLICULAR LYMPHOMA GRADE I, EXTRNOD AND SOLID ORGAN SITES"
C8210,"FOLLICULAR LYMPHOMA GRADE II, UNSPECIFIED SITE"
C8302,"SMALL CELL B-CELL LYMPHOMA, INTRATHORACIC LYMPH NODES"
C8304,"SMALL CELL B-CELL LYMPHOMA, NODES OF AXILLA AND UPPER LIMB"
C84A1,"CUTAN T-CELL LYMPHOMA, UNSP NODES OF HEAD, FACE, AND NECK"
C865,ANGIOIMMUNOBLASTIC T-CELL LYMPHOMA
C9110,CHRONIC LYMPHOCYTIC LEUK OF B-CELL TYPE NOT ACHIEVE REMIS
C9190,"LYMPHOID LEUKEMIA, UNSPECIFIED NOT HAVING ACHIEVED REMISSION"
C9211,"CHRONIC MYELOID LEUKEMIA, BCR/ABL-POSITIVE, IN REMISSION"
D0222,CARCINOMA IN SITU OF LEFT BRONCHUS AND LUNG
D030,MELANOMA IN SITU OF LIP
D0370,"MELANOMA IN SITU OF UNSPECIFIED LOWER LIMB, INCLUDING HIP"
D039,"MELANOMA IN SITU, UNSPECIFIED"
D0471,"CARCINOMA IN SITU OF SKIN OF RIGHT LOWER LIMB, INCLUDING HIP"
D0592,UNSPECIFIED TYPE OF CARCINOMA IN SITU OF LEFT BREAST
D061,CARCINOMA IN SITU OF EXOCERVIX
D072,CARCINOMA IN SITU OF VAGINA
D093,CARCINOMA IN SITU OF THYROID AND OTHER ENDOCRINE GLANDS
D102,BENIGN NEOPLASM OF FLOOR OF MOUTH
D106,BENIGN NEOPLASM OF NASOPHARYNX
D124,BENIGN NEOPLASM OF DESCENDING COLON
D132,BENIGN NEOPLASM OF DUODENUM
D1330,BENIGN NEOPLASM OF UNSPECIFIED PART OF SMALL INTESTINE
D1339,BENIGN NEOPLASM OF OTHER PARTS OF SMALL INTESTINE
D1602,BENIGN NEOPLASM OF SCAPULA AND LONG BONES OF LEFT UPPER LIMB
D1631,BENIGN NEOPLASM OF SHORT BONES OF RIGHT LOWER LIMB
D1721,"BENIGN LIPOMATOUS NEOPLASM OF SKIN, SUBCU OF RIGHT ARM"
D176,BENIGN LIPOMATOUS NEOPLASM OF SPERMATIC CORD
D2121,"BEN NEOPLM OF CONNCTV/SOFT TISS OF RIGHT LOWER LIMB, INC HIP"
D214,BENIGN NEOPLASM OF CONNECTIVE AND OTH SOFT TISSUE OF ABDOMEN
D215,BENIGN NEOPLASM OF CONNECTIVE AND OTH SOFT TISSUE OF PELVIS
D235,OTHER BENIGN NEOPLASM OF SKIN OF TRUNK
D2360,"OTH BENIGN NEOPLASM SKIN/ UNSP UPPER LIMB, INC SHOULDER"
D252,SUBSEROSAL LEIOMYOMA OF UTERUS
D271,BENIGN NEOPLASM OF LEFT OVARY
D280,BENIGN NEOPLASM OF VULVA
D3012,BENIGN NEOPLASM OF LEFT RENAL PELVIS
D3140,BENIGN NEOPLASM OF UNSPECIFIED CILIARY BODY
D334,BENIGN NEOPLASM OF SPINAL CORD
D351,BENIGN NEOPLASM OF PARATHYROID GLAND
D352,BENIGN NEOPLASM OF PITUITARY GLAND
D3613,"BEN NEOPLM OF PRPH NRV & AUTONM NRV SYS OF LOW LMB, INC HIP"
D3702,NEOPLASM OF UNCERTAIN BEHAVIOR OF TONGUE
D4012,NEOPLASM OF UNCERTAIN BEHAVIOR OF LEFT TESTIS
D4100,NEOPLASM OF UNCERTAIN BEHAVIOR OF UNSPECIFIED KIDNEY
D4101,NEOPLASM OF UNCERTAIN BEHAVIOR OF RIGHT KIDNEY
D413,NEOPLASM OF UNCERTAIN BEHAVIOR OF URETHRA
D420,NEOPLASM OF UNCERTAIN BEHAVIOR OF CEREBRAL MENINGES
D4701,CUTANEOUS MASTOCYTOSIS
D4959,NEOPLASM OF UNSPECIFIED BEHAVIOR OF OTHER GU ORGAN
D4989,NEOPLASM OF UNSPECIFIED BEHAVIOR OF OTHER SPECIFIED SITES
D508,OTHER IRON DEFICIENCY ANEMIAS
D550,ANEMIA DUE TO GLUCOSE-6-PHOSPHATE DEHYDROGENASE DEFICIENCY
D5720,SICKLE-CELL/HB-C DISEASE WITHOUT CRISIS
D580,HEREDITARY SPHEROCYTOSIS
D596,HEMOGLOBINURIA DUE TO HEMOLYSIS FROM OTHER EXTERNAL CAUSES
D600,CHRONIC ACQUIRED PURE RED CELL APLASIA
D643,OTHER SIDEROBLASTIC ANEMIAS
D680,VON WILLEBRAND DISEASE
D6832,HEMORRHAGIC DISORD D/T EXTRINSIC CIRCULATING ANTICOAGULANTS
D698,OTHER SPECIFIED HEMORRHAGIC CONDITIONS
D7583,THROMBOCYTOSIS
D828,IMMUNODEFICIENCY ASSOCIATED WITH OTH MAJOR DEFECTS
D841,DEFECTS IN THE COMPLEMENT SYSTEM
D8989,"OTH DISRD INVOLVING THE IMMUNE MECHANISM, NEC"
E018,OTH IODINE-DEFICIENCY RELATED THYROID DISORD AND ALLIED COND
E0500,THYROTOXICOSIS W DIFFUSE GOITER W/O THYROTOXIC CRISIS
E0510,THYROTXCOSIS W TOXIC SING THYROID NODULE W/O THYROTXC CRISIS
E0511,THYROTXCOSIS W TOXIC SINGLE THYROID NODULE W THYROTXC CRISIS
E0829,DIABETES DUE TO UNDRL CONDITION W OTH DIABETIC KIDNEY COMP
E0844,DIABETES DUE TO UNDERLYING CONDITION W DIABETIC AMYOTROPHY
E0865,DIABETES DUE TO UNDERLYING CONDITION W HYPERGLYCEMIA
E0922,DRUG/CHEM DIABETES W DIABETIC CHRONIC KIDNEY DISEASE
E1051,TYPE 1 DIABETES W DIABETIC PERIPHERAL ANGIOPATH W/O GANGRENE
E1059,TYPE 1 DIABETES MELLITUS WITH OTH CIRCULATORY COMPLICATIONS
E1100,TYPE 2 DIAB W HYPROSM W/O NONKET HYPRGLY-HYPROS COMA (NKHHC)
E232,DIABETES INSIPIDUS
E250,CONGENITAL ADRENOGENITAL DISORDERS ASSOC W ENZYME DEFICIENCY
E271,PRIMARY ADRENOCORTICAL INSUFFICIENCY
E300,DELAYED PUBERTY
E512,WERNICKE'S ENCEPHALOPATHY
E518,OTHER MANIFESTATIONS OF THIAMINE DEFICIENCY
E58,DIETARY CALCIUM DEFICIENCY
E60,DIETARY ZINC DEFICIENCY
E619,"DEFICIENCY OF NUTRIENT ELEMENT, UNSPECIFIED"
E700,CLASSICAL PHENYLKETONURIA
E710,MAPLE-SYRUP-URINE DISEASE
E7229,OTHER DISORDERS OF UREA CYCLE METABOLISM
E7289,OTHER SPECIFIED DISORDERS OF AMINO-ACID METABOLISM
E739,"LACTOSE INTOLERANCE, UNSPECIFIED"
E7529,OTHER SPHINGOLIPIDOSIS
E756,"LIPID STORAGE DISORDER, UNSPECIFIED"
E786,LIPOPROTEIN DEFICIENCY
E8020,UNSPECIFIED PORPHYRIA
E896,POSTPROCEDURAL ADRENOCORTICAL (-MEDULLARY) HYPOFUNCTION
F0153,"VASCULAR DEMENTIA, UNSPECIFIED SEVERITY, WITH MOOD DISTURB"
F01C0,"VASCULAR DEMENTIA, SEVERE, WITHOUT BEH/PSYCH/MOOD/ANX"
F1092,"ALCOHOL USE, UNSPECIFIED WITH INTOXICATION"
F1093,"ALCOHOL USE, UNSPECIFIED WITH WITHDRAWAL"
F1098,"ALCOHOL USE, UNSP WITH OTHER ALCOHOL-INDUCED DISORDERS"
F1110,"OPIOID ABUSE, UNCOMPLICATED"
F1113,OPIOID ABUSE WITH WITHDRAWAL
F1114,OPIOID ABUSE WITH OPIOID-INDUCED MOOD DISORDER
F1120,"OPIOID DEPENDENCE, UNCOMPLICATED"
F1122,OPIOID DEPENDENCE WITH INTOXICATION
F1124,OPIOID DEPENDENCE WITH OPIOID-INDUCED MOOD DISORDER
F1219,CANNABIS ABUSE WITH UNSPECIFIED CANNABIS-INDUCED DISORDER
F1222,CANNABIS DEPENDENCE WITH INTOXICATION
F1521,"OTHER STIMULANT DEPENDENCE, IN REMISSION"
F1524,OTH STIMULANT DEPENDENCE W STIMULANT-INDUCED MOOD DISORDER
F1591,"OTHER STIMULANT USE, UNSPECIFIED, IN REMISSION"
F1620,"HALLUCINOGEN DEPENDENCE, UNCOMPLICATED"
F1820,"INHALANT DEPENDENCE, UNCOMPLICATED"
F1928,OTH PSYCHOACTIVE SUBSTANCE DEPENDENCE W OTH DISORDERS
F201,DISORGANIZED SCHIZOPHRENIA
F21,SCHIZOTYPAL DISORDER
F251,"SCHIZOAFFECTIVE DISORDER, DEPRESSIVE TYPE"
F3110,"BIPOLAR DISORD, CRNT EPISODE MANIC W/O PSYCH FEATURES, UNSP"
F3162,"BIPOLAR DISORDER, CURRENT EPISODE MIXED, MODERATE"
F3181,BIPOLAR II DISORDER
F323,"MAJOR DEPRESSV DISORD, SINGLE EPSD, SEVERE W PSYCH FEATURES"
F4000,"AGORAPHOBIA, UNSPECIFIED"
F4001,AGORAPHOBIA WITH PANIC DISORDER
F4002,AGORAPHOBIA WITHOUT PANIC DISORDER
F4310,"POST-TRAUMATIC STRESS DISORDER, UNSPECIFIED"
F4321,ADJUSTMENT DISORDER WITH DEPRESSED MOOD
F4324,ADJUSTMENT DISORDER WITH DISTURBANCE OF CONDUCT
F441,DISSOCIATIVE FUGUE
F445,CONVERSION DISORDER WITH SEIZURES OR CONVULSIONS
F459,"SOMATOFORM DISORDER, UNSPECIFIED"
F5082,AVOIDANT/RESTRICTIVE FOOD INTAKE DISORDER
F5101,PRIMARY INSOMNIA
F513,SLEEPWALKING [SOMNAMBULISM]
F551,ABUSE OF HERBAL OR FOLK REMEDIES
F601,SCHIZOID PERSONALITY DISORDER
F602,ANTISOCIAL PERSONALITY DISORDER
F630,PATHOLOGICAL GAMBLING
F02A1,"DEM IN OTHER DISEASES CLASSD ELSWHR, MILD, WITH BEH DISTURB"
F6389,OTHER IMPULSE DISORDERS
F8181,DISORDER OF WRITTEN EXPRESSION
F919,"CONDUCT DISORDER, UNSPECIFIED"
F938,OTHER CHILDHOOD EMOTIONAL DISORDERS
F980,ENURESIS NOT DUE TO A SUBSTANCE OR KNOWN PHYSIOL CONDITION
F983,PICA OF INFANCY AND CHILDHOOD
F985,ADULT ONSET FLUENCY DISORDER
G0401,POSTINFECT ACUTE DISSEM ENCEPHALITIS AND ENCEPHALOMYELITIS
G0489,OTHER MYELITIS
G0491,"MYELITIS, UNSPECIFIED"
G08,INTRACRANIAL AND INTRASPINAL PHLEBITIS AND THROMBOPHLEBITIS
G1221,AMYOTROPHIC LATERAL SCLEROSIS
G131,OTH SYSTEMIC ATROPHY AFF CNSL IN NEOPLASTIC DISEASE
G212,SECONDARY PARKINSONISM DUE TO OTHER EXTERNAL AGENTS
G218,OTHER SECONDARY PARKINSONISM
G245,BLEPHAROSPASM
G249,"DYSTONIA, UNSPECIFIED"
G2583,BENIGN SHUDDERING ATTACKS
G3182,LEIGH'S DISEASE
G409,"EPILEPSY, UNSPECIFIED"
G4459,OTHER COMPLICATED HEADACHE SYNDROME
G454,TRANSIENT GLOBAL AMNESIA
G460,MIDDLE CEREBRAL ARTERY SYNDROME
G463,BRAIN STEM STROKE SYNDROME
G4710,"HYPERSOMNIA, UNSPECIFIED"
G4719,OTHER HYPERSOMNIA
G4727,CIRCADIAN RHYTHM SLEEP DISORDER IN CONDITIONS CLASSD ELSWHR
G4730,"SLEEP APNEA, UNSPECIFIED"
G4739,OTHER SLEEP APNEA
G511,GENICULATE GANGLIONITIS
G5131,"CLONIC HEMIFACIAL SPASM, RIGHT"
G543,"THORACIC ROOT DISORDERS, NOT ELSEWHERE CLASSIFIED"
G5610,"OTHER LESIONS OF MEDIAN NERVE, UNSPECIFIED UPPER LIMB"
G5690,UNSPECIFIED MONONEUROPATHY OF UNSPECIFIED UPPER LIMB
G5722,"LESION OF FEMORAL NERVE, LEFT LOWER LIMB"
G5732,"LESION OF LATERAL POPLITEAL NERVE, LEFT LOWER LIMB"
G5742,"LESION OF MEDIAL POPLITEAL NERVE, LEFT LOWER LIMB"
G5770,CAUSALGIA OF UNSPECIFIED LOWER LIMB
G5790,UNSPECIFIED MONONEUROPATHY OF UNSPECIFIED LOWER LIMB
G603,IDIOPATHIC PROGRESSIVE NEUROPATHY
G619,"INFLAMMATORY POLYNEUROPATHY, UNSPECIFIED"
G64,OTHER DISORDERS OF PERIPHERAL NERVOUS SYSTEM
G7100,"MUSCULAR DYSTROPHY, UNSPECIFIED"
G721,ALCOHOLIC MYOPATHY
G808,OTHER CEREBRAL PALSY
G8101,FLACCID HEMIPLEGIA AFFECTING RIGHT DOMINANT SIDE
G8250,"QUADRIPLEGIA, UNSPECIFIED"
G8310,MONOPLEGIA OF LOWER LIMB AFFECTING UNSPECIFIED SIDE
G8311,MONOPLEGIA OF LOWER LIMB AFFECTING RIGHT DOMINANT SIDE
G903,MULTI-SYSTEM DEGENERATION OF THE AUTONOMIC NERVOUS SYSTEM
G919,"HYDROCEPHALUS, UNSPECIFIED"
G936,CEREBRAL EDEMA
G9601,"CRANIAL CEREBROSPINAL FLUID LEAK, SPONTANEOUS"
G971,OTHER REACTION TO SPINAL AND LUMBAR PUNCTURE
G972,INTRACRANIAL HYPOTENSION FOLLOWING VENTRICULAR SHUNTING
G9749,ACC PNCTR & LAC OF NERVOUS SYS ORG DURING OTH PROCEDURE
H0211,CICATRICIAL ECTROPION OF EYELID
H0251,ABNORMAL INNERVATION SYNDROME
H0289,OTHER SPECIFIED DISORDERS OF EYELID
H0421,EPIPHORA DUE TO EXCESS LACRIMATION
H0523,HEMORRHAGE OF ORBIT
H0524,CONSTANT EXOPHTHALMOS
H0581,CYST OF ORBIT
H0589,OTHER DISORDERS OF ORBIT
H1011,"ACUTE ATOPIC CONJUNCTIVITIS, RIGHT EYE"
H1022,PSEUDOMEMBRANOUS CONJUNCTIVITIS
H1114,"CONJUNCTIVAL XEROSIS, UNSPECIFIED"
H1142,CONJUNCTIVAL EDEMA
H1189,OTHER SPECIFIED DISORDERS OF CONJUNCTIVA
H1613,PHOTOKERATITIS
H1639,OTHER INTERSTITIAL AND DEEP KERATITIS
H1789,OTHER CORNEAL SCARS AND OPACITIES
H1851,ENDOTHELIAL CORNEAL DYSTROPHY
H1889,OTHER SPECIFIED DISORDERS OF CORNEA
H2000,UNSPECIFIED ACUTE AND SUBACUTE IRIDOCYCLITIS
H2126,IRIS ATROPHY (ESSENTIAL) (PROGRESSIVE)
H2141,"PUPILLARY MEMBRANES, RIGHT EYE"
H2142,"PUPILLARY MEMBRANES, LEFT EYE"
H219,UNSPECIFIED DISORDER OF IRIS AND CILIARY BODY
H2512,"AGE-RELATED NUCLEAR CATARACT, LEFT EYE"
H2521,"AGE-RELATED CATARACT, MORGAGNIAN TYPE, RIGHT EYE"
H2522,"AGE-RELATED CATARACT, MORGAGNIAN TYPE, LEFT EYE"
H2640,UNSPECIFIED SECONDARY CATARACT
H278,OTHER SPECIFIED DISORDERS OF LENS
H3022,"POSTERIOR CYCLITIS, LEFT EYE"
H3089,OTHER CHORIORETINAL INFLAMMATIONS
H319,UNSPECIFIED DISORDER OF CHOROID
H3300,UNSPECIFIED RETINAL DETACHMENT WITH RETINAL BREAK
H3412,"CENTRAL RETINAL ARTERY OCCLUSION, LEFT EYE"
H3535,CYSTOID MACULAR DEGENERATION
H4020,UNSPECIFIED PRIMARY ANGLE-CLOSURE GLAUCOMA
H409,UNSPECIFIED GLAUCOMA
H4313,"VITREOUS HEMORRHAGE, BILATERAL"
H4420,"DEGENERATIVE MYOPIA, UNSPECIFIED EYE"
H4489,OTHER DISORDERS OF GLOBE
H4732,DRUSEN OF OPTIC DISC
H4930,"TOTAL (EXTERNAL) OPHTHALMOPLEGIA, UNSPECIFIED EYE"
H5034,INTERMITTENT ALTERNATING EXOTROPIA
H5061,BROWN'S SHEATH SYNDROME
H5332,FUSION WITH DEFECTIVE STEREOPSIS
H5353,DEUTERANOMALY
H5500,UNSPECIFIED NYSTAGMUS
H5509,OTHER FORMS OF NYSTAGMUS
H5909,OTHER DISORDERS OF THE EYE FOLLOWING CATARACT SURGERY
H5981,CHORIORETINAL SCARS AFTER SURGERY FOR DETACHMENT
H6040,"CHOLESTEATOMA OF EXTERNAL EAR, UNSPECIFIED EAR"
H6059,OTHER NONINFECTIVE ACUTE OTITIS EXTERNA
H608X,OTHER OTITIS EXTERNA
H6100,UNSPECIFIED PERICHONDRITIS OF EXTERNAL EAR
H6111,ACQUIRED DEFORMITY OF PINNA
H6122,"IMPACTED CERUMEN, LEFT EAR"
H6500,"ACUTE SEROUS OTITIS MEDIA, UNSPECIFIED EAR"
H6522,"CHRONIC SEROUS OTITIS MEDIA, LEFT EAR"
H6523,"CHRONIC SEROUS OTITIS MEDIA, BILATERAL"
H6530,"CHRONIC MUCOID OTITIS MEDIA, UNSPECIFIED EAR"
H6533,"CHRONIC MUCOID OTITIS MEDIA, BILATERAL"
H6690,"OTITIS MEDIA, UNSPECIFIED, UNSPECIFIED EAR"
H7112,"CHOLESTEATOMA OF TYMPANUM, LEFT EAR"
H7192,"UNSPECIFIED CHOLESTEATOMA, LEFT EAR"
H7200,"CENTRAL PERFORATION OF TYMPANIC MEMBRANE, UNSPECIFIED EAR"
H7312,"CHRONIC MYRINGITIS, LEFT EAR"
H7391,"UNSPECIFIED DISORDER OF TYMPANIC MEMBRANE, RIGHT EAR"
H7493,"UNSPECIFIED DISORDER OF MIDDLE EAR AND MASTOID, BILATERAL"
H8141,null
H9012,"CONDCTV HEAR LOSS, UNI, LEFT EAR, W UNRESTR HEAR CNTRA SIDE"
H9192,"UNSPECIFIED HEARING LOSS, LEFT EAR"
H9193,"UNSPECIFIED HEARING LOSS, BILATERAL"
H9201,"OTALGIA, RIGHT EAR"
H9220,"OTORRHAGIA, UNSPECIFIED EAR"
I00,RHEUMATIC FEVER WITHOUT HEART INVOLVEMENT
I079,"RHEUMATIC TRICUSPID VALVE DISEASE, UNSPECIFIED"
I088,OTHER RHEUMATIC MULTIPLE VALVE DISEASES
I169,"HYPERTENSIVE CRISIS, UNSPECIFIED"
I202,REFRACTORY ANGINA PECTORIS
I209,"ANGINA PECTORIS, UNSPECIFIED"
I21A9,OTHER MYOCARDIAL INFARCTION TYPE
I228,SUBSEQUENT STEMI OF SITES
I230,HEMOPERICARDIUM AS CURRENT COMPLICATION FOLLOWING AMI
I231,ATRIAL SEPTAL DEFECT AS CURRENT COMPLICATION FOLLOWING AMI
I241,DRESSLER'S SYNDROME
I253,ANEURYSM OF HEART
I2571,ATHEROSCLEROSIS OF AUTOLOGOUS VEIN CABG W ANGINA PECTORIS
I2583,CORONARY ATHEROSCLEROSIS DUE TO LIPID RICH PLAQUE
I271,KYPHOSCOLIOTIC HEART DISEASE
I288,OTHER DISEASES OF PULMONARY VESSELS
I300,ACUTE NONSPECIFIC IDIOPATHIC PERICARDITIS
I311,CHRONIC CONSTRICTIVE PERICARDITIS
I348,OTHER NONRHEUMATIC MITRAL VALVE DISORDERS
I361,NONRHEUMATIC TRICUSPID (VALVE) INSUFFICIENCY
I424,ENDOCARDIAL FIBROELASTOSIS
I429,"CARDIOMYOPATHY, UNSPECIFIED"
I4430,UNSPECIFIED ATRIOVENTRICULAR BLOCK
I480,PAROXYSMAL ATRIAL FIBRILLATION
I4901,VENTRICULAR FIBRILLATION
I5030,UNSPECIFIED DIASTOLIC (CONGESTIVE) HEART FAILURE
I5033,ACUTE ON CHRONIC DIASTOLIC (CONGESTIVE) HEART FAILURE
I615,"NONTRAUMATIC INTRACEREBRAL HEMORRHAGE, INTRAVENTRICULAR"
I6349,CEREBRAL INFARCTION DUE TO EMBOLISM OF OTHER CEREBRAL ARTERY
I6354,CEREB INFRC DUE TO UNSP OCCLS OR STENOSIS OF CEREBLR ARTERY
I6501,OCCLUSION AND STENOSIS OF RIGHT VERTEBRAL ARTERY
I6521,OCCLUSION AND STENOSIS OF RIGHT CAROTID ARTERY
I663,OCCLUSION AND STENOSIS OF CEREBELLAR ARTERIES
I6782,CEREBRAL ISCHEMIA
I6902,SPEECH/LANG DEFICITS FOLLOWING NTRM SUBARACHNOID HEMORRHAGE
I6935,HEMIPLEGIA AND HEMIPARESIS FOLLOWING CEREBRAL INFARCTION
I6985,HEMIPLGA FOLLOWING OTH CEREBROVASCULAR DISEASE
I6992,SPEECH/LANG DEFICITS FOLLOWING UNSP CEREBROVASCULAR DISEASE
I7020,UNSP ATHEROSCLEROSIS OF NATIVE ARTERIES OF EXTREMITIES
I7032,ATHSCL UNSP TYPE BYPASS OF THE EXTREMITIES W REST PAIN
I719,"AORTIC ANEURYSM OF UNSPECIFIED SITE, WITHOUT RUPTURE"
I7381,ERYTHROMELALGIA
I7419,EMBOLISM AND THROMBOSIS OF OTHER PARTS OF AORTA
I7779,DISSECTION OF OTHER SPECIFIED ARTERY
I7782,ANTINEUTROPHILIC CYTOPLASMIC ANTIBODY [ANCA] VASCULITIS
I8010,PHLEBITIS AND THROMBOPHLEBITIS OF UNSPECIFIED FEMORAL VEIN
I8012,PHLEBITIS AND THROMBOPHLEBITIS OF LEFT FEMORAL VEIN
I820,BUDD-CHIARI SYNDROME
I8243,ACUTE EMBOLISM AND THROMBOSIS OF POPLITEAL VEIN
I824Y,ACUTE EMBLSM AND THOMBOS UNSP DEEP VEINS OF PROX LOW EXTRM
I8270,CHRONIC EMBOLISM AND THOMBOS UNSP VEINS OF UPPER EXTREMITY
I8301,VARICOSE VEINS OF RIGHT LOWER EXTREMITY WITH ULCER
I864,GASTRIC VARICES
I871,COMPRESSION OF VEIN
I952,HYPOTENSION DUE TO DRUGS
I9762,"POSTP HEMOR, HEMATOMA & SEROMA OF CIRC SYS ORG FOL OTH PROC"
I9788,"OTH INTRAOPERATIVE COMPLICATIONS OF THE CIRC SYS, NEC"
J0131,ACUTE RECURRENT SPHENOIDAL SINUSITIS
J0190,"ACUTE SINUSITIS, UNSPECIFIED"
J0410,ACUTE TRACHEITIS WITHOUT OBSTRUCTION
J102,INFLUENZA DUE TO OTH IDENT INFLUENZA VIRUS W GI MANIFEST
J112,INFLUENZA DUE TO UNIDENTIFIED INFLUENZA VIRUS W GI MANIFEST
J129,"VIRAL PNEUMONIA, UNSPECIFIED"
J159,UNSPECIFIED BACTERIAL PNEUMONIA
J211,ACUTE BRONCHIOLITIS DUE TO HUMAN METAPNEUMOVIRUS
J310,CHRONIC RHINITIS
J322,CHRONIC ETHMOIDAL SINUSITIS
J391,OTHER ABSCESS OF PHARYNX
J40,"BRONCHITIS, NOT SPECIFIED AS ACUTE OR CHRONIC"
J8402,PULMONARY ALVEOLAR MICROLITHIASIS
J8403,IDIOPATHIC PULMONARY HEMOSIDEROSIS
J860,PYOTHORAX WITH FISTULA
J930,SPONTANEOUS TENSION PNEUMOTHORAX
J9503,MALFUNCTION OF TRACHEOSTOMY STOMA
J9610,"CHRONIC RESPIRATORY FAILURE, UNSP W HYPOXIA OR HYPERCAPNIA"
J983,COMPENSATORY EMPHYSEMA
J9859,"OTHER DISEASES OF MEDIASTINUM, NOT ELSEWHERE CLASSIFIED"
K030,EXCESSIVE ATTRITION OF TEETH
K032,EROSION OF TEETH
K044,ACUTE APICAL PERIODONTITIS OF PULPAL ORIGIN
K0500,"ACUTE GINGIVITIS, PLAQUE INDUCED"
K055,OTHER PERIODONTAL DISEASES
K056,"PERIODONTAL DISEASE, UNSPECIFIED"
K0811,COMPLETE LOSS OF TEETH DUE TO TRAUMA
K0822,MODERATE ATROPHY OF THE MANDIBLE
K0859,OTHER UNSATISFACTORY RESTORATION OF TOOTH
K1123,CHRONIC SIALOADENITIS
K131,CHEEK AND LIP BITING
K136,IRRITATIVE HYPERPLASIA OF ORAL MUCOSA
K144,ATROPHY OF TONGUE PAPILLAE
K2271,BARRETT'S ESOPHAGUS WITH DYSPLASIA
K260,ACUTE DUODENAL ULCER WITH HEMORRHAGE
K263,ACUTE DUODENAL ULCER WITHOUT HEMORRHAGE OR PERFORATION
K2950,UNSPECIFIED CHRONIC GASTRITIS WITHOUT BLEEDING
K311,ADULT HYPERTROPHIC PYLORIC STENOSIS
K316,FISTULA OF STOMACH AND DUODENUM
K319,"DISEASE OF STOMACH AND DUODENUM, UNSPECIFIED"
K31A2,GASTRIC INTESTINAL METAPLASIA WITH DYSPLASIA
K3531,"ACUTE APPENDICITIS WITH LOC PERITONITIS AND GANGR, W/O PERF"
K4030,"UNIL INGUINAL HERNIA, W OBST, W/O GANGR, NOT SPCF AS RECUR"
K421,UMBILICAL HERNIA WITH GANGRENE
K433,"PARASTOMAL HERNIA WITH OBSTRUCTION, WITHOUT GANGRENE"
K5141,INFLAMMATORY POLYPS OF COLON WITH COMPLICATIONS
K5289,OTHER SPECIFIED NONINFECTIVE GASTROENTERITIS AND COLITIS
K5505,"ACUTE (REVERSIBLE) ISCHEMIA OF INTESTINE, PART UNSPECIFIED"
K551,CHRONIC VASCULAR DISORDERS OF INTESTINE
K5731,DVRTCLOS OF LG INT W/O PERFORATION OR ABSCESS W BLEEDING
K5753,DVTRCLI OF BOTH SMALL AND LG INT W/O PERF OR ABSCESS W BLEED
K624,STENOSIS OF ANUS AND RECTUM
K669,"DISORDER OF PERITONEUM, UNSPECIFIED"
K6811,POSTPROCEDURAL RETROPERITONEAL ABSCESS
K753,"GRANULOMATOUS HEPATITIS, NOT ELSEWHERE CLASSIFIED"
K761,CHRONIC PASSIVE CONGESTION OF LIVER
K8020,CALCULUS OF GALLBLADDER W/O CHOLECYSTITIS W/O OBSTRUCTION
K8037,CALCULUS OF BILE DUCT W ACUTE AND CHRONIC CHOLANGITIS W OBST
K8062,CALCULUS OF GB AND BILE DUCT W ACUTE CHOLECYST W/O OBST
K8065,CALCULUS OF GB AND BILE DUCT W CHRONIC CHOLECYST W OBST
K812,ACUTE CHOLECYSTITIS WITH CHRONIC CHOLECYSTITIS
K829,"DISEASE OF GALLBLADDER, UNSPECIFIED"
K869,"DISEASE OF PANCREAS, UNSPECIFIED"
K903,PANCREATIC STEATORRHEA
K9181,OTHER INTRAOPERATIVE COMPLICATIONS OF DIGESTIVE SYSTEM
K929,"DISEASE OF DIGESTIVE SYSTEM, UNSPECIFIED"
K9422,GASTROSTOMY INFECTION
L0203,CARBUNCLE OF FACE
L0232,FURUNCLE OF BUTTOCK
L0261,CUTANEOUS ABSCESS OF FOOT
L043,ACUTE LYMPHADENITIS OF LOWER LIMB
L120,BULLOUS PEMPHIGOID
L128,OTHER PEMPHIGOID
L22,DIAPER DERMATITIS
L2381,ALLERGIC CONTACT DERMATITIS DUE TO ANIMAL (CAT) (DOG) DANDER
L253,UNSP CONTACT DERMATITIS DUE TO OTHER CHEMICAL PRODUCTS
L291,PRURITUS SCROTI
L299,"PRURITUS, UNSPECIFIED"
L300,NUMMULAR DERMATITIS
L401,GENERALIZED PUSTULAR PSORIASIS
L45,PAPULOSQUAMOUS DISORDERS IN DISEASES CLASSIFIED ELSEWHERE
L562,PHOTOCONTACT DERMATITIS [BERLOQUE DERMATITIS]
L571,ACTINIC RETICULOID
L574,CUTIS LAXA SENILIS
L678,OTHER HAIR COLOR AND HAIR SHAFT ABNORMALITIES
L701,ACNE CONGLOBATA
L702,ACNE VARIOLIFORMIS
L729,"FOLLICULAR CYST OF THE SKIN AND SUBCUTANEOUS TISSUE, UNSP"
L738,OTHER SPECIFIED FOLLICULAR DISORDERS
L741,MILIARIA CRYSTALLINA
L8915,PRESSURE ULCER OF SACRAL REGION
L8952,PRESSURE ULCER OF LEFT ANKLE
L8990,"PRESSURE ULCER OF UNSPECIFIED SITE, UNSPECIFIED STAGE"
L920,GRANULOMA ANNULARE
L9722,NON-PRESSURE CHRONIC ULCER OF LEFT CALF
L9730,NON-PRESSURE CHRONIC ULCER OF UNSPECIFIED ANKLE
